UNewBrunswick,STAT2593,Probability and Statistics for Engineers, , ,"Probability spaces: combinatorial probability; conditional probability and independence. Random variables: discrete distributions; continuous distributions; expectation, variance, and covariance; linear combinations. Statistics: descriptive and graphical statistics; sampling distributions. Inference: point estimation; confidence intervals; hypothesis tests; paired data designs; two sample inference."
UNewBrunswick,ME4173*,Robot Kinematics, , ,Structure and specification of robotic manipulators. Homogeneous transformations and link descriptions. Manipulator forward and inverse displacement solutions. Jacobians in the velocity and static force domains. Singular configurations and workspace analysis. An introduction to trajectory planning and manipulator dynamics. Lab experiments explore several robotic manipulators.
UNewBrunswick,ME4622*,Human Factors Engineering , , ,"An interdisciplinary study of the interaction of humans and their workspace. Physiological principles of work and energy. Anthropometry. Biomechanics. The ergonomics of workspace and job design. Fatigue. Work/rest schedules and nutrition. The physiological and psychological effects of human noise, vibration, lighting, vision, and the workspace environment. Lab periods include seminars and practical design exercise applying human factors and ergonomic theory to workspace problems."
UNewBrunswick,ME4703*,Mechanical Engineering Measurements, , ,"Discusses a variety of measurement techniques used in Mechanical Engineering.  Topics include analog and digital measurement systems, frequency response, calibration and assessment of uncertainty. The focus is on the analysis and design of measuring instruments.  Laboratory exercises include measures of time and rate, displacements, stress and strain, force, pressure, flow, temperature, and vibrations."
UNewBrunswick,ME5113,Advanced Solid Mechanics of Composites, , ,"Introduction to stress analysis that deals with anisotropy of stress and general equations of the theory and elasticity. The elastic equilibrium and boundary value problem formulations are considered. Introduction to the modelling of inhomogeneous composite solids, the effective moduli theory and the elasticity of laminated and fiber enforced composite, as well as nanostructured composite theories are covered."
UNewBrunswick,ME5122*,Solid State Phenomena, , ,"Covers the fundamental aspects of crystallographic structure and their effects on the physical and mechanical properties of solids wiith emphasis on metallic materials with engineering applications. The importance of selecting alloying elements will be explored to optimize various properties such as but not limited to strength, ductility, fatigue, creep, corrosion, electrical, and magnetic. Construction and analysis of binary and ternary phase diagrams, which are critical in alloy design, complemented with computational thermodynamics will be covered. At the end of the course, the students are expected to understand the design and processing of commercial alloys."
UNewBrunswick,ME5173*,Advanced Kinematics of Manipulators, , ,Various methods for solving the forward and inverse displacement problems are described. Particular emphasis is made on the use of screw theory for the derivation of the Jacobian matrix. The selection of alternate frames of reference for describing the Jacobian are also discussed. Methods used in the solution of the inverse displacement problem and the inverse and forward velocity problems for kinematically redundant manipulators are discussed.
UNewBrunswick,ME5183*,Industrial Robotics and Automation, , ,"Brief introduction to robot kinematics including forward and inverse displacement and velocity solutions. An introduction to trajectory planning. Description of common uses of robotics in the manufacturing industry. Description and differences between soft and hard automation particularly in material handling systems. Fundamentals of sensors, actuators and controllers. Examples of automated machinery conveyor systems, feeder systems and packaging systems. Lab introduces different components of a flexible manufacturing systems. Graduate students enrolling in this course must submit an additional project in order to receive credit for this course."
UNewBrunswick,ME5223*,Finite Element Analysis, , ,"Introduction to the basic concepts of finite element analysis (FEA) including domain discretization, element types, system matrix assembly, and numerical solution techniques. Application of FEA to solve static, dynamic and harmonic problems of linearly elastic solid bodies and heat transfer will be covered in detail. Graduate students enrolling in this course must submit an additional project in order to receive credit for this course."
UNewBrunswick,ME5243*,Machining Theory and Practice, , ,"The fundamentals of metal cutting theory will be examined with particular emphasis on understanding cutting forces, stresses, strains, strain rates, and temperatures during the cutting process. Tribological issues, tool wear, and tool life will also be presented. Tools typically available to the manufacturing engineer such as Computer-Aided Design (CAD), Computer Aided Manufacturing (CAM), and Computer Numerical Control (CNC) Programming will compromise a significant portion of the course. Using the machine shop in the Mechanical Engineering Department, students will extend classroom concepts to practical scenarios and situations on the machine shop floor."
UNewBrunswick,ME5253*,Codified Design and Failure Analysis, , ,"This senior level course examines the application of mechanical design to engineering practice. In particular, the course will examine codified design of steel structures and the analysis of common failures that occur in service."
UNewBrunswick,ME5283*,Micro/Nano Manufacturing, , ,"Review of principles and practices of micro/nano fabrication technologies with research and industrial perspectives.  Introduction to micro/nano fabrication and its applications in MEMS/NEMS, renewable energy and biomaterials; materials selection; silicon processing; lithography process; thin film fabrication; advanced lithography process; characterization and micro/nano measurement techniques; atomic force microscopy and its applications."
UNewBrunswick,ME5353*,Fracture Mechanics, , ,"Principles of fractures mechanics and fracture analysis of engineering structures. Plane elasticity and mathematical methods to determine the elastic stress, strain and displacement fields. Fracture criteria and their limitations. Elastic-plastic fracture mechanics, J integral and COD. Fatigue fracture and S-N curve."
UNewBrunswick,ME5493*,Internal Combustion Engines, , ,The thermodynamics of internal combustion engines is introduced and applied to reciprocating spark ignition and compression ignition engines. The performance of each engine type is studied experimentally. The mechanical design of reciprocating engines is also examined.
UNewBrunswick,ME5503*,Application of Computational Fluid Dynamics to Industrial Processes , , ,"General CFD topics such as grid topologies, discretization methods and errors, pressure-velocity coupling, solution methods for non-linear equations, and popular solution schemes such as the SIMPLE based methods. Introduction of extensions to core CFD techniques for a wide range of industrial applications, including turbulence models, multiphase flow models for problems in cavitation, boiling/condensation, and solidification/melting. Role of properties in CFD models, as related to non-Newtonian fluids, real and ideal properties for compressible flows, and combustion applications."
UNewBrunswick,ME5534*,Experimental Methods in Fluid Dynamics, , ,"This course will cover topics including the methodology, measurement uncertainty, and signal processing associated with fluid dynamics measurements. Various means of measuring pressure, velocity and visualizing flow will also be discussed."
UNewBrunswick,ME5553*,Ocean Wave Energy Conversion, , ,"Introduction to the fundamental concepts of ocean wave energy conversion. Topics include: ocean wave mechanics, the wave energy resource, basic wave energy conversion techniques, analytical and experimental modelling of wave energy converter, power take-off systems, and environmental impact assessment."
UNewBrunswick,ME5578*,Low Speed Aerodynamics, , ,"Fluid mechanics principles will be applied to describe external flow of incompressible gasses and liquids.  Emphasis will be placed on techniques used to predict aerodynamic forces and moments on aircraft.  Applications include aerofoils of infinite span, wing of finite span, aerodynamic design considerations, and high lift devices.  Other applications include the aerodynamics of wind-turbines and submarine hydrodynamics.  An introduction to computational aerodynamics will also be given."
UNewBrunswick,ME5588*,High Speed Aerodynamics, , ,"The principles of thermodynamics and fluid mechanics will be applied to describe external flow of compressible gases. Applications include two dimensional aerofoils, slender wings, aircraft and ballistics."
UNewBrunswick,ME5643*,Automatic Controls II , , ,The first half of the course is an introduction to digital control. Emphasis is placed on understanding the relationships between analog and digital techniques. The second half concentrates on developing the basic mathematical framework for state space control. Several powerful abstract mathematical tools such as the projection theorem are introduced.
UNewBrunswick,ME5653*,Predictive Control and Intelligent Sensors, , ,"Study on the design and practical implementation of model predictive controllers and intelligent sensors for industrial type processes. Topics to be studied include sensor selection and instrumentation, signal processing and conditioning, process modelling and identification, computer interfacing, predictive control, optimization techniques, algorithm design and intelligent sensor modelling. The course is project oriented and includes the use of Matlab and LabWindows CVI software."
UNewBrunswick,ME5673,Acoustics, , ,"Review of single degree of freedom oscillators, vibration of strings and bars. Topics include: the acoustic wave equation, transmission phenomena, pipe cavities and waveguides, resonators, ducts and filters, environmental acoustics and an introduction to aeroacoustics (time permitting)."
UNewBrunswick,ME5713*,Nondestructive Testing, , ,"Principles of nondestructive evaluation, acoustic emission techniques, ultrasonics, microwave methods, electromagnetic probes, penetrating radiation."
UNewBrunswick,ME5813*,Special Topics in Mechanical Engineering, , ,Provides selected students an opportunity to either study concepts of a newly developed course or complete an independent project in association with an undergraduate course within the department. Permission of the instructor of the associated course is required.
UNewBrunswick,ME5833*,Special Topics in Mechanical Engineering, , ,Provides selected students an opportunity to either study concepts of a newly developed course or complete an independent or group-based course of study within the department. Permission of the instructor of an associated course is required.
UNewBrunswick,ME5913*,Biomechanics I, , ,"A number of topics in biomechanics are examined. Of particular interest is the mechanics of joints, and relation of the internal mechanics of joints to externally applied loads. Analysis techniques are introduced to facilitate analysis of the problems addressed in the course."
UNewBrunswick,ME5933*,Industrial Ecology and Sustainable Engineering , , ,The goal is to develop awareness and knowledge on forward-looking thinking of interaction of technology with human induced transformation of materials and energy from the perspectives of environment and sustainability. Topics include: humanity and technology; concept of sustainability; key questions of industrial ecology and sustainable engineering; status of resources; technology and risk assessment; introduction to life cycle assessment (LCA); LCA impact assessment and interpretation; streamlining the LCA process.
UNewBrunswick,ME5953*,Embedded Flight Control Systems, , ,"Describes the aerodynamic forces, moments and propulsive thrusts which act on fixed wing model aircraft. Stability, control, and flight performance characteristics are also investigated. Development of a system model and theoretical control algorithm tailored for the characteristics of a specific model airplane. Each student will use this knowledge to develop an embedded firmware-based control system to provide some autopilot features to a model airplane."
UNewBrunswick,APSC3953,Basis of Biomedical Engineering,biomedical, ,"This course introduces the general aspects of Biomedical Engineering, which is the application of engineering principles to study biology, medicine, behaviour and health. A number of areas are covered by this broad topic, including anatomy, muscle physiology, biomedical instrumentation, biomechanics, and prosthetics. It will also introduce students to the idea of Biomedical Engineering as a career choice."
UNewBrunswick,CS3025,Human-Computer Interaction,biomedical, ,"Software design for interactive computing. Topics include: human-computer interaction principles, interface design guidelines, the design and execution of usability studies. The characteristics of various styles of interaction are explored. Emphasis is on user-oriented interfaces. Students design, implement, and perform a usability study on an interactive software application."
UNewBrunswick,ECE4343,Haptic Robotics,biomedical, ,"Haptics is the science and technology of creating the sensation of touch using robotic devices. This course will cover the three interelated domains of human physiology, mechatronics and control, to develop haptic robots that render a variety of environments."
UNewBrunswick,KIN3041,Disability Awareness,biomedical, ,"This course aims to introduce students to the issues and challenges faced by persons with disabilities by exploring: disability concepts from a social, medical and political perspective; the impacts of disability on the person, family unit and labor force; disability issues in movement activities, from daily living to sport and recreation skills. Disability awareness training includes an introduction to appropriate terminology, knowledge of specific disorders that cause disability, and experience working with disabled individuals in the community."
UNewBrunswick,KIN3061,Advanced Biomechanics,biomedical, ,"Examines, through lecture and the use of lab-based data, the theoretical and applied aspects of the biomechanics of human performance."
UNewBrunswick,KIN3161,Human Factors in Ergonomic Design,biomedical, ,"This course introduces the physical, biomechanical, psycho-social and cognitive demands on workers in both office and industrial settings. Through lectures, student projects and review of current research, the role of proper human factors as a component of the improvement of health and well-being of the worker are explored. The understanding of human physical and psychological capabilities and limitations are incorporated in proper ergonomic design of the workplace environment."
UNewBrunswick,KIN4063,Biomechanical Instrumentation and Data Acquisition ,biomedical, ,"Introduces advanced concepts in instrumentation and data acquisition relevant to the area of human motion analysis. The student will be introduced to motion analysis systems, electromyographs, and force platforms through laboratory sessions. Emphasis will be placed on accuracy and reliability of equipment. Students will also be introduced to the Matlab programming language and various data analysis techniques in biomechanics (i.e. filtering, joint angle computation)."
UNewBrunswick,KIN4161,Occupational Biomechanics,biomedical, ,"This course will examine topics in applied ergonomics and occupational biomechanics. Lectures will be used to present ergonomic assessment tools and present current research directives in the area of occupational biomechanics and prevention of workplace musculoskeletal injuries. Development of the skills required to identify occupational ergonomic concerns, perform biomechanical analyses of musculoskeletal demands and modifications of work tasks to reduce musculoskeletal demands will be emphasized through practical experiences."
UNewBrunswick,KIN4162,Occupational Health and Safety for Ergonomists,biomedical, ,"This course will provide an overview of the occupational health and safety field and its relationship to workplace ergonomics. An introduction to occupational health and safety legislation will be provided and health and safety hazards in a variety of work environments will be examined. Emphasis will be placed on how to eliminate and reduce hazards and risks associated with several work processes, including the physical working environment, adaptation of tools and the workplace to the worker, and equipment design. The roles and responsibilities of workers and their employers will also be covered."
UNewBrunswick,KIN4163,Workplace Ergonomic Design and Analysis,biomedical, ,"The focus of this course is on the theoretical background and practical knowledge required to create functional ergonomic designs and provide comprehensive ergonomic analyses of industrial or service workplaces using work measurement and task analysis methodologies. Industrial and human factors engineering techniques together with the principles of occupational biomechanics are applied to investigate human / machine interactions, job design, and workstation layout. Work Measurement and Task Analysis methodologies are used to describe and determine work standards, physiological task loads and the elements of manual and mental activities in human / machine work systems. Laboratory exercises provide the opportunity to apply the theory to actual workplace situations."
UNewBrunswick,PHYS5993,Magnetic Resonance Imaging (O),biomedical, ,"Role within programme and connections to other courses. This advanced course draws upon electromagnetism, quantum mechanics and statistical thermodynamics to provide a capstone topic tied to the department’s research interests. Content. Principles of Magnetic Resonance Imaging, survey of imaging techniques, modern applications of MRI in medicine, biology and materials science."
UNewBrunswick,ECE2214,Digital Logic Design,mechatronics, ,"An introductory course to practical aspects of digital system design. The course covers digital logic design, including basic design concepts and implementation technology, number representation, synthesis of combinational and sequential logic, and the use of HDL and computer-based tools."
UNewBrunswick,ECE2215,Digital Logic Design Laboratory ,mechatronics, ,This is an introductory course to practical aspects of digital system design. Course includes the design of digital circuits with CAD tools and VHDL hardware description language.
UNewBrunswick,ME4673,Introduction to Mechatronics,mechatronics, ,"Mechatronics is an integrated approach to mechanical, electronic and computer engineering for the design of “smart” products and “intelligent” manufacturing systems. Fundamentals of mechatronics design, with emphasis on product design and fabrication. Examples of mechanical systems utilizing sensors and actuator technologies, including use of signal conditioning circuits such as filters, amplifiers and analog-to-digital converters. Software design and implementation for process monitoring and logic control. Laboratory experiments give hands-on experience with components and equipment used in the design of mechatronic products. Project to design and fabricate a mechatronic system."
UNewBrunswick,ME4683,Mechatronics Applications ,mechatronics, ,"Concepts in automating processes. System specifications, components identification/selection, programming and interfacing for system automation and control. Project involving use of PLC or microprocessor technology in a mechatronics system."
UNewBrunswick,ECE3221,Computer Organization,mechatronics, ,"Register transfer systems and datapaths, microprocessors, microprocessor architecture and operation, instruction formats, assembly language programming, procedures and parameter passing, system bus timing, interfacing memory IO ports, serial and parallel data transfer, interrupts."
UNewBrunswick,ECE4323,Modern Control Systems and Applications ,mechatronics, ,"Introduces the industrial context for the application of control theory, including system modeling (linear, nonlinear, discrete, continuous and probabilistic models) and problem definition, determining system components and architectures, dealing with limitations and constraints (nonlinearity, disturbances and uncertainties), standard and advanced controls design (linear, nonlinear, and optimal control methods) and tuning methods. Computer-aided controls engineering is emphasized (algorithms/MATLAB)."
UNewBrunswick,ECE4333,Robotics,mechatronics, ,"This is a project based course where students design a variety of subsystems that are integrated and tested on a mobile robot. Topics include: actuators, PWM, H-bridges, position and range sensors, velocity sensors, optical sensors and switches, strain gauges, position and velocity control, electro-mechanical subsystems, planning and trajectory generation, computer software and hardware interfacing."
UNewBrunswick,ECE4923,Introduction to Biomedical Engineering,mechatronics, ,"Introduces biomedical concepts in the context of electrical engineering. Topics covered include basic anatomy and physiology, biopotential origination and modelling, biosignal measurement instrumentation, biosignal analysis and a survey of medical devices and health care technologies."
