Course Number,Course Name,Course Description
BGM721,Biomécanique du mouvement,"Résoudre des problématiques en biomécanique du mouvement dans le domaine de la conception de produits, du sport et du biomédical. Cibler l’anatomie et la physiologie normales et pathologiques des muscles du corps humain impliqués dans le mouvement. Créer des modèles mécaniques et électriques représentant les parties du corps humain impliquées dans le mouvement et leur fonctionnement normal et pathologique, à l’aide d’une méthode cohérente et systématique. Mesurer et analyser un signal biomécanique de mouvement du corps humain normal et pathologique, à l’aide d’un instrument existant et d’étapes cohérentes et systématiques. Anatomie : système musculaire des membres supérieurs et inférieurs, mouvement chez l’être humain et locomotion en tout genre. Modélisation : méthode de modélisation, modèles de la protéine contractile musculaire, du mouvement humain, de la marche ou de la course. Expérimentation : étapes d’expérimentation, mesures de force musculaire, d’électromyographie et d’analyse du mouvement (GPS, ergomètres, plateformes de forces, accéléromètres ou caméras optoélectroniques)."
BGM722,Conception interdisciplinaire en bio-ingénierie,"Déterminer les spécifications fonctionnelles relatives à la conception d’un système biomédical. Analyser un système biomédical en regard de ses spécifications fonctionnelles. Concevoir un prototype conceptuel expérimental fonctionnel d’un système biomédical dans un contexte interdisciplinaire. Introduction à la conception en bio-ingénierie : éléments d’anatomie et de physiologie, ergonomie, certification, contexte socio-commercial, recherche de données pertinentes pour la conception en bio-ingénierie; conception de systèmes biomédicaux dans un contexte interdisciplinaire."
BGM723,Analyse de cas en bio-ingénierie,"Prédire le comportement et la performance d'un dispositif mécanique utilisé dans les domaines du sport, de l'orthopédie et de la réadaptation. Modéliser la forme 3D d’un objet à géométrie complexe. Créer des plans de cotation fonctionnelle fondés sur une analyse de risque détaillée et des calculs d'ingénierie. Choisir le ou les matériaux les plus appropriés pour la conception des dispositifs. Réaliser le prototypage d'un dispositif. Éléments d'anatomie et de physiologie de l'os. Logiciels de calcul numérique. Modélisation 3D. Cotation fonctionnelle. Analyse de risque. Biomatériaux. Conception détaillée. Prototypage rapide 3D."
GMC725,Matériaux composites,"Maîtriser la fabrication d’un matériau en composite, concevoir une pièce simple en composite, optimiser les propriétés du composite lors de la fabrication, modéliser le comportement mécanique simple d’un composite, intégrer les préoccupations environnementales lors de la fabrication. Introduction, nature des renforts, composites à matrice organique thermodurcissable ou thermoplastique, composites à matrice métallique ou céramique, interface renfort/matrice, caractérisation de l'adhésion interfaciale, procédés de fabrication, nanocomposites, composites verts."
GMC732,"Comportement, optimisation et rupture des structures composites","Maîtriser les lois et principes de la mécanique des matériaux composites   et la théorie des plaques laminées; appliquer ces lois aux calculs   d’éléments structuraux en composites laminés, en composites sandwichs et   aux éléments d’assemblage en composites tout en analysant le   comportement face à la fatigue, à l'impact et à la rupture. Se   familiariser avec les techniques d’optimisation des orientations des   couches dans un laminé anisotrope et quasi-isotrope, et l’optimisation   des empilements en fonction du chargement. Caractéristiques des composites, substitution du métal par un composite,   applications aéronautiques et défi. Théorie des plaques stratifiées,   composites à fibres courtes, composites orthotropes, rupture des   matériaux composites, délaminage des composites, résistance des   composites aux impacts, fatigue des matériaux composites, calcul des   structures composites, calcul des poutres et des plaques en flexion,   techniques d'optimisation et applications, assemblage des composites et   assurance qualité."
GMC760,Nanocaractérisation des semiconducteurs,"Se familiariser avec les méthodes de caractérisation des matériaux utilisés en micro-ingénierie, afin de permettre une sélection éclairée dans le cadre d'un projet de recherche. Développer une approche critique et utilitaire de la caractérisation des semiconducteurs. Élargir ses connaissances fonctionnelles d'un maximum de techniques de caractérisation. Théorie des matériaux cristallins. Mesures optiques : photoluminescence, interférométrie, ellipsométrie, diffusion Raman, diffraction des rayons-X, mesures optiques de surface. Mesures par faisceaux de particules chargées : microscopie électronique, diffractions des électrons, faisceaux d'ions."
GMC761,Genèse et caractérisation des couches minces,Développer une connaissance générale de la croissance épitaxiale de couches minces de semi-conducteurs. Comprendre les principes physicochimiques gouvernant le processus de croissance. Reconnaître les principales différences entre les techniques de croissance épitaxiale. Rudiments de cristallographie. Reconstruction de surfaces. Modes de croissance. Nanostructures. Boîtes quantiques. Fils quantiques. Caractérisation des couches. Applications spéciales. Nitrures. Oxydes. Couches magnétiques. Autres techniques de dépôt. Épitaxie assistée par laser. Épitaxie en phase vapeur aux hydrures (HVPE). Dépôt par laser pulsé.
GMC762,Introduction aux microsystèmes électromécaniques,"S'initier aux microsystèmes électromécaniques (MEMS) et comprendre leurs bénéfices pour diverses applications, leurs principes de fonctionnement et leurs méthodes de fabrication les plus courantes. Introduction aux microsystèmes électromécaniques (MEMS). Applications et marchés. Matériaux et procédés de microfabrication appliqués aux MEMS. Principes de fonctionnement des microcapteurs et actionneurs. Étude de cas sur des dispositifs MEMS commerciaux. Introduction à la microfluidique et aux bioMEMS."
GMC763,Micro-ingénierie des MEMS,"Rendre l'étudiante ou l'étudiant apte à concevoir des microsystèmes électromécaniques (MEMS), en maîtrisant les principes de micro-ingénierie la sélection des matériaux et procédés. Rendre l'étudiante ou l'étudiant apte à définir de nouvelles applications pour la microtechnologie. Impact de la miniaturisation. Propriétés des matériaux utilisés en microfabrication. Mécanique des microstructures. Principes de transduction électrostatique, électrorésistive, piezoélectrique et thermique. Microfluidique : mécanique des fluides à bas nombre de Reynolds, électrocinétique, transfert de chaleur, composantes microfluidiques. Conception de MEMS. Études de cas. Essais en laboratoire sur des MEMS."
GMC764,Intégration thermique et mécanique des structures microfabriquées,"Être capable de concevoir des solutions d'encapsulation (packaging) de microsystèmes, en comprenant et en analysant les principes affectant leur fonctionnalité, leurs performances thermiques et électriques, ainsi que leur robustesse et leur fiabilité. Enjeux reliés à l'encapsulation de différents microsystèmes, dont les circuits intégrés, les MEMS et les dispositifs à forte densité de puissance; approches modernes d'encapsulation, incluant les procédés industriels associés; conception et analyse des solutions thermiques pour les microsystèmes encapsulés; défauts et modes de défaillance des structures encapsulées; simulations numériques, analyses et mesures de fiabilité."
GBA415,Systèmes mécaniques CVAC,"Expliquer le fonctionnement des systèmes de chauffage, ventilation et air climatisé (CVAC) et concevoir des éléments de ces systèmes selon les normes en vigueur. Psychométrie. Mécanique des fluides et transfert de chaleur. Introduction à la conception et à l’analyse des systèmes de chauffage, de ventilation et d’air climatisé (CVAC). Données climatiques et charges thermiques. Confort. Diagnostic. Fonctionnement et conception des équipements : systèmes de distribution et de traitement d’air et des fluides, échangeurs et pompes à chaleur, systèmes de réfrigération. Calcul des conduites, grilles, chaudières, convecteurs et systèmes de plomberie. Normes de l'American Society of Heating, Refrigerating and Air-Conditioning Engineers (ASHRAE)."
GMC250,Moteurs à combustion interne à pistons,"Connaître les principes de la combustion et les utiliser dans la synthèse des cycles Otto et Diesel; acquérir des connaissances générales sur le fonctionnement des moteurs. Combustion avec dissociation. Cycles Otto et Diesel avec transformations réversibles et avec pertes de chaleur et de masse : mesures, friction, admission, évacuation, carburateurs et injecteurs, pertes thermiques, chambre de combustion, allumage, détonation, émissions, combustibles, lubrifiants, performances."
GMC743,Turbulence : expérimentation et modélisation,"Comprendre les caractéristiques principales des écoulements turbulents.   Décrire les principaux outils d'analyse des écoulements turbulents.   Développer les équations analytiques pour les écoulements turbulents   incompressibles. Prendre connaissance des approches et modèles   numériques utilisés en pratique. S'initier aux simulations numériques   des écoulements turbulents. Outils mathématiques, statistiques et expérimentaux d'analyse de la   turbulence. Équations du mouvement turbulent pour les écoulements   incompressibles. Simulation numérique des écoulements turbulents (DNS,   LES, RANS). Turbulence homogène et isotrope. Écoulement turbulent   cisaillé et de paroi."
GMC750,Thermodynamique avancée,"Approfondir les notions de thermodynamique classique; acquérir les bases de la thermodynamique irréversible et de la thermodynamique statistique. Bilans d'entropie, d'exergie, d'énergie, irréversibilité, 3e loi de la thermodynamique. Relations de Maxwell. Propriétés des corps réels, construction de tables thermodynamiques. Propriétés des mélanges. Équilibre de phase, combustion, dissociation. Thermodynamique. Statistique : définition statistique de l'entropie et de la température. Distributions thermodynamiques de la Théorie quantique des gaz. Thermodynamique irréversible. Tenseur des coefficients phénoménologiques. Relation de Onsager."
GMC751,Transmission de chaleur avancée,"Maîtriser les méthodes d'analyse et de résolution des problèmes complexes de transfert de chaleur. Bilans d'énergie: conduction, convection, rayonnement. Équations de conservation. Solutions analytiques et semi-analytiques. Couches limites. Méthodes de résolution numérique de problèmes de conduction et de convection : méthode aux différences finies; variables primitives : méthode de Patankar; variables secondaires: courant-vorticité; coordonnées curvilignes pour géométries irrégulières. Applications."
GMC756,Aérothermique expérimentale,"Connaître les principes de l'approche expérimentale et des systèmes de mesure pour l'étude de phénomènes en aérothermique; choisir et utiliser les instruments de mesure appropriés pour l'étude d'un phénomène. Variables d'un phénomène et échelles caractéristiques. Principes de la mesure et de la chaîne de mesure. L'erreur, l'incertitude et le traitement des données mesurées. Outils expérimentaux seuls et dans la chaîne de mesure : outils de simulation expérimentale, outils de mesure (capteurs primaires, convertisseurs intermédiaires et enregistrement final), l'effet de la chaîne, outils optiques et visualisation."
GMC757,Combustion et dynamique des gaz,Maîtriser les principes physico-chimiques en jeu dans les phénomènes de combustion. Thermodynamique de la combustion. Cinétique chimique appliquée à la combustion. Phénomènes de transport. Écoulements compressibles stationnaires et instationnaires. Explosions en système fermé. Flammes laminaires et turbulentes. Détonations. Combustion de liquides et de brouillards. Sources de pollution. Applications et aspects de sécurité.
GMC766,Introduction aux turbomachines,"Développer les compétences requises pour la conception, l’analyse et l’optimisation de diverses machines tournantes à basse et haute vitesse, basées sur les principes de conservation généraux. Description et distinction de tout type de machine tournante; analyse dimensionnelle et équations de conservation dans les turbomachines; dimensionnement d’une machine tournante depuis la sélection basée sur des nombres adimensionnels jusqu’au calcul numérique 3D par CFD (Computational Fluid Dynamics); introduction au calcul numérique; mesures de performances aérodynamiques et aéroacoustiques; conception rapide de maquettes."
GMC767,Introduction à la mécanique des fluides numérique,"Acquérir un niveau intermédiaire en mécanique des fluides numérique (CFD). Choisir, appliquer et analyser/évaluer la bonne méthode numérique pour un problème fluide donné. Séances de cours magistraux et de travaux pratiques couvrant 5 grandes thématiques : formulation d’équations de conservation résolues en simulation numérique; méthodes numériques pour la mécanique des fluides; modélisation de la turbulence pour la mécanique des fluides numérique; analyse des écoulements fluides; simulations multi-physiques et calcul parallèle approfondis en considérant les écoulements diphasiques ou réactifs. Mise en pratique des méthodes acquises dans un mini-projet numérique réalisé en groupe. Accompagnement des étudiantes et étudiants dans leur mini-projet de simulation."
GCH532,Génie environnemental,"Acquérir les bases du génie de l'environnement; connaître le contexte légal dans lequel l'ingénieure ou l'ingénieur exerce ses activités; prendre conscience du rôle à jouer par rapport à la protection de l'environnement; développer, par la réalisation d'un projet intégrateur, les compétences de travail en équipe et savoir communiquer efficacement les résultats dans ce domaine. Nuisances environnementales. Types. Sources, nature et ampleur des déchets. Toxicité et risque. Aspects législatifs. Classification des matières dangereuses. Lois, règlements et normes pour les rejets. Les juridictions. Responsabilité de l'ingénieure ou de l'ingénieur. Gestion des nuisances environnementales. Approches préventive et curative. Aperçu des technologies de traitement des effluents gazeux, liquides et solides. Gestion de la qualité de l'eau, des sols et de l'air. Calcul de la concentration des polluants rejetés dans le milieu. Magnitude des traitements requis. Évaluation des impacts. Nature des impacts, procédure d'évaluation environnementale. Contenu du rapport d'impact. Les juridictions. Audiences publiques. L'ingénieure ou l'ingénieur et la société. Rôle de l'ingénieure ou de l'ingénieur, responsabilité sociale et champs d'action. Éthique. Gestion intégrée et développement durable. Normes ISO. Importance de la communication avec le public."
GCH738,Gestion des matières résiduelles,"Connaître les principes et maîtriser les outils nécessaires à une saine gestion des matières résiduelles dans le cadre municipal et dans le cadre d'activités commerciales et institutionnelles ou de production industrielle. Caractéristiques des matières résiduelles et leurs impacts sur l'environnement. Aspects législatifs à considérer. Stratégies et technologies de réduction à la source, réutilisation, recyclage, valorisation et disposition. Projet par équipe d'analyse d'un processus de gestion d'une matière résiduelle."
GCI736,Analyse du cycle de vie et écoconception,"Acquérir une formation de base en écoconception. Maîtriser l'analyse du cycle de vie et l'appliquer à des projets d'ingénierie. Les stratégies et les outils d'écoconception. L'analyse du cycle de vie comme outil de développement durable et comme outil d'écoconception. Le contenu des normes ISO 14040 et 14044 sur l'analyse du cycle de vie. Les distinctions entre analyse environnementale, économique et sociale du cycle de vie. Les différents logiciels et banques de données utilisés en analyse du cycle de vie."
ACT652,Projet de création d'entreprise technologique,"Déterminer les actions destinées à mener un projet de création de produit technologique vers un modèle d’affaires d’une entreprise viable, et en encadrer le suivi. Par la voie d’interactions auprès d’un coach : énoncé clair de la raison d’être du projet d’entreprise et des objectifs de performance, planification de l’exécution, suivi des actions de validation permettant de mieux mesurer la viabilité ou non du modèle d’affaires du projet d’entreprise. Apprentissages enseignés et interactions dans le contexte des projets respectifs de création de produit technologique des participantes et participants."
ACT654,Projet de création d’entreprise technologique II,"Réviser les éléments d’une équipe performante; évaluer les efforts de validation des composantes du modèle d’affaires, mettre à jour les données de propriété intellectuelle et de veille concurrentielle, repérer les risques du projet; utiliser les prototypes pour aider à l’évolution du modèle d’affaires; faire des premières ventes tests d’une première itération de produits. Coaching et accompagnement personnalisé selon les besoins des équipes; raison d’être du projet; objectifs de performance; composantes d’activités clés, de ressources clés et de structure de coûts du modèle d’affaires; propriété intellectuelle; intelligence d’affaires; vente de son produit."
ACT656,Projet de création d’entreprise technologique III,Réviser et évaluer les efforts de validation des composantes du modèle d’affaires; réviser et évaluer la performance de l’équipe; démontrer sa capacité à communiquer auprès de différentes cibles de financement de projet; négocier des partenariats; reconnaître les défis à venir pour mettre en œuvre le passage d’un projet de création d’un produit technologique vers un modèle d’affaires d’une entreprise viable. Coaching et accompagnement personnalisé selon les besoins des équipes; ensemble des composantes du modèle d’affaires; raison d’être du projet; objectifs de performance; communication; partenariats; négociation; évaluation de projet.
