Course Number,Course Name,Course Description
ING510,Communication en ingénierie,Consolider et mûrir la compétence en communication amorcée lors du premier cours de communication qui précède dans le programme. La compétence en rédaction écrite sera consolidée par les apprentissages en argumentation et en vulgarisation scientifique. Elle sera mûrie par l'application à la rédaction de rapports techniques et d'écrits spécifiques. La compétence en échanges oraux sera amorcée et mûrie par l'apprentissage de l'exposé oral. Le niveau de compétence sera atteint par l'apprentissage des attitudes favorisant une bonne communication. Méthodes pour argumenter techniquement. Les règles de l'art pour les rapports et les écrits spécifiques en ingénierie. Les règles de l'art pour l'exposé oral. Les bases de la vulgarisation scientifique. Les attitudes favorisant une bonne communication.
ING515,Professionnalisme,Être apte à choisir et maintenir le style de professionnalisme approprié aux circonstances; être capable de garder la maîtrise de son travail et d'assumer ses responsabilités; être capable de conseiller son client et de décider professionnellement. Lien entre le professionnalisme et les autres compétences du programme. Caractéristiques du professionnalisme. Les valeurs de la profession versus les valeurs individuelles. Les responsabilités professionnelles et légales de l'ingénieure et de l'ingénieur. Gestion de sa charge de travail. Planification de sa carrière. Le processus « conseil ». L'ingénieure ou l'ingénieur et l'éthique.
ING600,Introduction à l'ingénierie,"S'initier à l'historique de la profession d'ingénieur ou d'ingénieure ainsi qu'à son rôle et à ses défis en tant qu'ingénieur ou ingénieure dans la société. Étapes historiques de la profession d'ingénieur et d'ingénieure, des premiers temps jusqu'à nos jours, en soulignant les principales réalisations et catastrophes. Gaz à effet de serre et réchauffement de la planète : contexte et évolution du phénomène, conséquences actuelles et futures, les solutions possibles. Particularités du génie mécanique et l'interface avec la société. Les grands défis modernes de l'ingénierie. L'ingénieur et l'ingénieure innovateurs : rôle, processus et importance."
ING605,Travail en équipe et gestion du temps,"Développer l'aptitude à bien gérer son temps et à travailler efficacement en équipe dans la conception et la réalisation de projets d'ingénierie. Acquérir les compétences nécessaires à la pratique de l’ingénierie. Contexte et problématique de la gestion du temps et du travail d'équipe dans les projets d'ingénierie. Méthode de la gestion du temps basée sur les sept habitudes de Covey. Application de l'outil psychométrique Myers-Briggs à la compréhension de la dynamique du travail en équipe. Organigramme de travail et matrice des responsabilités. Préparation, gestion et suivi efficaces des réunions appliqués à un projet en ingénierie. Modes de prise de décision et critique constructive. Intelligence émotionnelle dans le contexte professionnel en ingénierie."
ING610,Initiation à la recherche scientifique,"S'initier à la méthode scientifique; connaître la recherche et les étapes conduisant à la carrière de chercheuse et de chercheur; apprendre à lancer des activités de recherche en entreprise. Histoire des sciences, les grands axes de recherche en sciences appliquées, la méthode scientifique, l'initiation à la recherche, la recherche en industrie."
ING615,Travail en équipe et leadership,"Renforcer la formation de base déjà acquise en travail d'équipe et en dynamique de groupe; prendre connaissance de quelques modèles et principes de base du leadership; appliquer les connaissances sur le travail en équipe et le leadership dans un contexte de travail en entreprise. Contexte, défis et enjeux du travail d'équipe en entreprise. Évolution des équipes de travail et les équipes haute performance. Rôle du leader dans une équipe de travail : leadership situationnel et leadership transformationnel. Outils de base qui favorisent une dynamique d'équipe efficace : consolidation d'équipe, communication, écoute active, rétroaction, gestion des conflits. Application des notions vues au contexte du travail en entreprise."
IMC917,Projet de conception III,"Développer ses aptitudes à fabriquer et à tester un prototype complet et fonctionnel. Acquisition des matériaux, des composantes, etc., fabrication des pièces, assemblage, plan de validation, essais physiques et en laboratoire, évaluation finale du prototype, exposition."
PMC660,Projet majeur de conception I,"Exécuter un projet de développement en ingénierie d’un produit/service, d’un procédé/application ou d’un système, selon le cahier des charges, les règles de l'art, les règlementations, les normes et les standards appropriés, de façon socialement responsable dans un contexte de développement durable. Gérer un projet d’ingénierie à partir d’un processus de gestion adapté aux besoins du projet, en respectant les meilleures pratiques du génie électrique/informatique/mécanique/robotique. Se comporter et communiquer de manière professionnelle dans la conduite d'un projet d'ingénierie d'envergure. Analyse, conception, réalisation, test et documentation d’un projet d’ingénierie, évaluation et validation de choix technologiques, utilisation des pratiques, des règlementations, des normes et des standards de conception, planification, suivi et gestion d'un projet, analyse des risques et mitigation, communication avec les intervenants appropriés. Comportement et communication démontrant son professionnalisme."
PMC760,Projet majeur de conception II,"Exécuter un projet de développement en ingénierie d’un produit/service, d’un procédé/application ou d’un système, selon le cahier des charges, les règles de l'art, les règlementations, les normes et les standards appropriés, de façon socialement responsable dans un contexte de développement durable. Gérer un projet d’ingénierie à partir d’un processus de gestion adapté aux besoins du projet, en respectant les meilleures pratiques du génie électrique/informatique/mécanique/robotique. Se comporter et communiquer de manière professionnelle dans la conduite d'un projet d'ingénierie d'envergure. Analyse, conception, réalisation, test et documentation d’un projet d’ingénierie, évaluation et validation de choix technologiques, utilisation des pratiques, des règlementations, des normes et des standards de conception, planification, suivi et gestion d'un projet, analyse des risques et mitigation, communication avec les intervenants appropriés. Comportement et communication démontrant son professionnalisme."
ANS200,Anglais intermédiaire I,"Poursuivre son acquisition des connaissances langagières et améliorer sa capacité à comprendre et à se faire comprendre; apprendre à écrire des textes simples en anglais. Description plus en profondeur de la structure de la langue: phonologie, morphologie, syntaxe, éléments de stylistique. Dialogues et mises en situation. Lectures et exercices oraux et écrits."
ANS300,Anglais intermédiaire II,"Accroître ses compétences en anglais afin de pouvoir comprendre, interagir et s'exprimer plus clairement, à l'oral comme à l'écrit, dans une gamme de situations courantes. Approfondissement des connaissances lexicales, syntaxiques et idiomatiques; activités guidées régulières et variées favorisant l'expression orale; entraînement à la compréhension, à l'expression écrite et au bon usage de la ponctuation en anglais."
ANS400,Anglais avancé I,Perfectionner ses aptitudes de compréhension et d'expression en anglais; saisir une grande variété de textes et de discours authentiques; pouvoir communiquer sans difficulté à l'oral comme à l'écrit dans la plupart des contextes. Révision de problèmes spécifiques à la structure de la langue anglaise; expressions idiomatiques; dialogues et mises en situation; entraînement à la lecture de textes variés et à la rédaction de textes clairs; attention particulière accordée à l'écoute active.
ANS500,Anglais avancé II,"Acquérir une certaine aisance dans la compréhension et l'expression en anglais : être en mesure de tenir une conversation courante; de comprendre tout genre de textes; de rédiger des textes clairs et structurés. Accent sur la langue parlée : discussions et présentations sur divers sujets d'actualité, mises en situation, idiomatismes; attention particulière à l'écoute active; travail sur du matériel authentique (média, …); lectures variées et exercices de communication écrite dans divers contextes et registres de langues; approfondissement grammatical et lexical."
ING170,Électricité et magnétisme,"Appliquer les lois de l'électricité et du magnétisme. Résoudre des circuits résistifs simples. Analyser la réponse de circuits RC et RL simples. Diagramme de propriétés, indice de performance, propriétés électriques, atome, électron, grandeur, unités électriques et magnétiques. Loi d'Ohm, courant, tension, résistance, conductance, multimètre. Circuit série, parallèle, Kirchhoff, Thévenin, superposition. Condensateur, Loi de Coulomb, diélectrique, temps de réponse, bobine, transformateur, induction électromagnétique, ferromagnétisme, moteur, génératrice. Courant et tension alternatifs, angle de phase, impédance, puissance, énergie, réponse en fréquence."
ING240,Introduction au calcul différentiel et intégral,"Appliquer les méthodes du calcul différentiel et intégral à l'étude de fonctions et à la résolution de problèmes. CALCUL DIFFÉRENTIEL : Fonctions et graphes, limites et continuité, la dérivée, applications de la dérivée. CALCUL INTÉGRAL : théorèmes d'analyse et règle de l'Hospital, l'intégrale, autres applications de l'intégrale, techniques d'intégration, séries infinies."
ING245,Introduction à l'algèbre linéaire,"Formuler les problèmes en utilisant les notions de vecteurs et de matrices. Résoudre des problèmes à l'aide de méthodes de l'algèbre linéaire et de la géométrie vectorielle. Langage matriciel, opérations sur les matrices, déterminant et inversion de matrices, résolution des systèmes d'équations linéaires, vecteurs du plan, nombres complexes, vecteurs de l'espace, droite et plan de l'espace et espaces vectoriels."
GIN502,Sécurité dans les groupes techniques I,"Expliquer en ses propres mots l’importance de la sécurité dans les groupes techniques (GT); mettre en pratique les principes de prévention acquis durant le cours ou prescrits par des collègues ou des personnes en autorité. Prévention des accidents (importance, processus accidentel et bonnes pratiques). Importance de la Santé et sécurité en milieu de travail et d’études (SSMTE) (Loi sur la santé et la sécurité du travail, Loi C-21, Politique 2500-004 SSMTE). Mesures d’urgence."
GIN503,Sécurité dans les groupes techniques II,"Comprendre le rôle de responsable de la sécurité pour un groupe technique (GT); reconnaître des outils et des ressources pouvant aider à assumer ce rôle; appliquer certains outils, dont les grilles d’inspection des laboratoires. Comprendre le rôle de responsable de la sécurité pour un groupe technique (GT); reconnaître des outils et des ressources pouvant aider à assumer ce rôle; appliquer certains outils, dont les grilles d’inspection des laboratoires."
GIN504,Introduction à l'analyse des risques,Comprendre comment se produit un accident. Reconnaître les phénomènes dangereux présents dans les laboratoires. Analyser les risques associés. Proposer des moyens de réduction des risques. Processus accidentel. Phénomènes dangereux types des espaces pour les groupes techniques (GT). Estimation des risques. Démarche et moyens de réduction des risques.
GMC404,Introduction à la modélisation géométrique,"Connaître les principales fonctions d'un logiciel de conception assistée par ordinateur (CAO) et plus spécifiquement celles utilisées pour la création d'un modèle géométrique; acquérir et appliquer les connaissances et procédures utilisées pour la création de modèles géométriques simples; concevoir et valider un modèle géométrique complet (pièces, assemblage principal, mises en plan) comprenant un mécanisme. Concepts généraux de la CAO, fonctions principales d'un logiciel de CAO, notions avancées concernant la modélisation géométrique, procédures de création et de validation d'un modèle géométrique, concepts de création en contexte, notions de paramétrage et utilisation de formules, conception d'un modèle géométrique fait de pièces et d'un assemblage principal, simulation d'un mécanisme, réalisation de mises en plan pour la fabrication."
GMC443,Pneumatique et hydraulique industrielles,"Acquérir les connaissances théoriques et les habiletés pour pouvoir concevoir et exploiter les systèmes électropneumatiques et électrohydrauliques industriels modernes. Propriétés physiques de l'air. Production, traitement et distribution de l'air comprimé. Unité de la pression. Composants des installations électropneumatiques, représentation symbolique et schémas. Dimensionnement d'un circuit électropneumatique. Exemples des commandes électropneumatiques. Principes physiques de l'hydraulique. Composants électrohydrauliques. Circuits électro-hydrauliques, exemples d'application. Logiciels Automation Studio, GRAFCET. Introduction à l'hydraulique proportionnelle."
GMC540,Planification de la production,"Acquérir des connaissances en gestion de la production et développer une compétence à organiser la production d'une entreprise manufacturière selon les meilleures pratiques d'affaires dans le domaine. Système Toyota, gestion de la qualité et amélioration continue, approche Kaizen et sa boîte à outils, approche Six Sigma, philosophie juste-à-temps, Supply Chain Management, localisation et aménagement de l'entreprise, gestion de la demande, planification et contrôle de la production, systèmes de gestion intégrés, gestion des stocks, gestion de l'approvisionnement, gestion de l'équipement et des installations, organisation du travail."
GMC710,Méthodes numériques de calcul en génie,"Maîtriser les principales méthodes numériques utilisées dans les problèmes de génie. Interpolation par le polynôme de Lagrange et approximation au sens des moindres carrés. Applications: régression polynomiale, différentiation et intégration numérique. Construction et analyse des schémas de résolution numérique des équations différentielles. Méthodes de Runge-Kutta, prédicteur-correcteur et multipas. Convergence, consistance et domaines de stabilité de ces schémas. Résolution des systèmes linéaires : méthodes directes et itératives. Application aux matrices creuses. Résolution des équations et systèmes non linéaires : méthodes du point fixe et de Newton-Raphson. Introduction aux schémas de résolution des équations aux dérivées partielles. Programmation des algorithmes."
GMC712,Traitement et analyse fréquentielle des données expérimentales,"Maîtriser les notions de base et les principales techniques modernes du traitement et de l'analyse des signaux expérimentaux et les appliquer à des cas concrets. Caractérisation des signaux, transformation temps-fréquence, transformée de Fourier discrète, FFT. Acquisition, échantillonnage, fenêtrage temporel. La convolution, l'analyse spectrale par la corrélation, la transformée de Fourier. Le filtrage analogique et digital. Conception de filtre digital et application."
GMC717,Conception mécanique avancée,"Développer sa capacité de proposer des solutions innovantes validées scientifiquement pour répondre à des problèmes non familiers en génie mécanique. Acquérir, pour ce faire, les compétences suivantes : formuler une problématique de conception et justifier une opportunité de marché dans le contexte socioéconomique réel; concevoir une solution créative par la méthode de l’analyse paramétrique; analyser scientifiquement la faisabilité de la solution créative proposée et évaluer le potentiel commercial de l’idée; exposer les résultats scientifiques et technologiques. Processus créatif en génie; organisation des idées selon la méthode FReDPARRC; principales méthodes de modélisation et d’expérimentation en conception; éléments de machine modernes; principes de conception en génie mécanique."
GMC733,Commande avancée en mécatronique,Maîtriser l'ensemble des notions théoriques et pratiques en commande   multivariable non linéaire pour le contrôle de systèmes mécatroniques. Modélisation des systèmes non linéaires multivariables. Linéarisation et   retour linéarisant. Commande par retour d'état. Commande par retour de   sortie. Analyse dans le domaine fréquentiel. Commande robuste.   Identification paramétrique. Commande adaptative.
GMC734,Dynamique avancée,"Formuler, résoudre de façon efficace et simuler les équations décrivant le mouvement en 3D de systèmes mécaniques complexes comprenant plusieurs corps rigides et soumis à des contraintes. Géométrie vectorielle algébrique 3D et différentielle. Tenseurs et propriétés de masse. Forces et moments. Équations et contraintes de mouvement. Degrés de libertés. Méthode de Newton-Euler. Conservation de la quantité de mouvement et de l’énergie. Principe de D’Alembert. Relations puissance, travail et énergie. Méthode de Kane. Résolution symbolique et numérique d’équations linéaires et non linéaires algébriques et différentielles."
GMC950,Projet de spécialité I,"Développer, par la réalisation d'un projet, un esprit de synthèse et appliquer les connaissances acquises à l'intérieur du programme à la solution d'un problème de génie d'envergure moyenne. Déterminé en accord avec une professeure ou un professeur dans le domaine du génie mécanique et approuvé par la direction du Département."
GMC955,Projet de spécialité II,"Développer, par la réalisation d'un projet, un esprit de synthèse et appliquer les connaissances acquises à l'intérieur du programme à la solution d'un problème de génie d'envergure moyenne. Déterminé en accord avec une professeure ou un professeur dans le domaine du génie mécanique et approuvé par la direction du Département."
GMC140,Acoustique et contrôle du bruit,"Maîtriser les bases théoriques et expérimentales permettant de réaliser efficacement la réduction du bruit. Acoustique physiologique. Pression, puissance, intensité, absorption, réflection, diffraction. Matériaux acoustiques. Acoustique des locaux. Techniques classiques de réduction du bruit. Instrumentation et techniques de mesure."
GMC720,Acoustique fondamentale,"Maîtriser les principales lois et les principaux phénomènes régissant la génération et la propagation des ondes acoustiques. Description et définitions des principaux paramètres acoustiques. Mouvements harmoniques. Équation d'onde, approche généralisée. Réflexion. Propagation. Volume ouvert et volume fermé. Diffraction. Transmission. Intensimétrie."
GMC721,Rayonnement acoustique des structures,"Comprendre la théorie et maîtriser les méthodes de calcul utilisées pour analyser les vibrations et le rayonnement acoustique de milieux continus simples. Formulation variationnelle des vibrations des milieux continus. Notions de base, fonctionnelle de Hamilton. Vibrations des poutres droites. Vibrations des plaques minces. Vibrations des coques minces. Méthode de Ritz. Rayonnement et transmission acoustique des structures. Rayonnement acoustique par les plaques infinies. Transmission acoustique par les plaques infinies. Méthodes intégrales en acoustique. Rayonnement acoustique par les plaques finies (analyse modale). Moyens de réduction du bruit."
GMC729,Aéroacoustique,"Comprendre les principes généraux de l'aéroacoustique et les appliquer   aux écoulements libres (jets), aux écoulements en paroi (profils,   ailes), en conduits et aux turbomachines. Dérivation de l'équation d'ondes en champ libre pour différentes   sources; dérivation de l'équation de Lighthill et principe des analogies   acoustiques; application de l'analogie de Lighthill aux écoulements   libres (bruit de couche de cisaillement et de jet); généralisation en   présence de parois fixes par l'analogie de Curle; généralisation aux   parois mobiles et notion de bruit de turbomachines; bruit de combustion   et notions de propagation dans un turboréacteur."
AMC700,Introduction à l'aéronautique,"Retracer les étapes marquantes de l’histoire de l’aéronautique et de la conquête de l’espace; expliquer le rôle des divers systèmes dans un véhicule aéronautique et spatial; expliquer la variation des propriétés de l’air avec l’altitude dans l’atmosphère standard; employer les bases des quatre principales disciplines de l’aérospatiale, soit l’aérodynamique, la mécanique de vol, la propulsion et la structure, dans un contexte général de conception de véhicules aérospatiaux; et appliquer dans un contexte simple le processus de conception d’un véhicule aéronautique et spatial. Avion à hélice; hélicoptère et drone; avion de transport de passagers réacté; avion de chasse supersonique; fusée; et nouvelles technologies."
AMC705,Aérodynamique et performance des hélicoptères,"Décrire les types d’hélicoptères ainsi que les méthodes de contrôle de ces véhicules; analyser l’effet des types de rotors sur les performances; évaluer la performance d’un hélicoptère en vol stationnaire, en déplacement, en montée et en descente; optimiser la géométrie et les paramètres d’opération d’une voilure tournante; résoudre le mouvement complexe d’un rotor d’hélicoptère soumis à des déplacements des contrôles; calculer la compensation et l’équilibre (trim) d’un hélicoptère en vol horizontal; et décrire les compromis requis dans la conception d’un hélicoptère. Introduction; théorie de Rankine-Froude appliquée à un rotor; théorie des éléments de pale combinée à la théorie de Rankine-Froude (BEMT : Blade element momentum theory); mouvement du rotor pour les rotors basculants (teetering), articulés et rigides; théorie des éléments de pale en vol vers l’avant; compensation et équilibre de l’hélicoptère (trim) en vol stationnaire et horizontal et évaluation des performances; et considération de conception pour les hélicoptères."
GMC747,Structures d'avions,"Appliquer les connaissances acquises en élasticité et résistance des matériaux au calcul de la résistance des structures aéronautiques. Résistance des structures : éléments d'élasticité, flexion des plaques,   résistance des coques (pression, flexion), résistance des multicoques.   Stabilité des structures : flambage des poutres, des plaques et des   coques. Applications aux structures d'avions. Principe des constructions   à âme mince. Calcul d'un élément de voilure ou de fuselage."
GMC748,Aérodynamique des avions,"Acquérir les connaissances nécessaires au calcul de charges   aérodynamiques sur les ailes et au calcul des performances des avions. Généralités : rappel des équations fondamentales, tourbillons, fonction   de courant. Écoulements de fluides parfaits incompressibles :   écoulements simples, cylindre, profils, théorie des profils minces,   propriétés expérimentales des profils, ailes d'envergure finie.   Écoulements de fluides parfaits compressibles : théorie des   caractéristiques en régime supersonique, théories linéarisées des   profils en régime subsonique et supersonique, frontière transsonique et   hypersonique. Performances des avions : vol stabilisé horizontal,   enveloppe de vol, distance franchissable, vol en montée et en descente,   ressource et virage."
GMC749,Mécanique du vol,"Évaluer la stabilité d'un avion et déterminer sa réponse aux   perturbations et aux commandes. Stabilité statique longitudinale manche libre et manche fixe, efforts   dans le manche, stabilité en manœuvre, stabilité statique latérale.   Dynamique de l'avion : équations générales, dérivées aérodynamiques,   mouvement longitudinal, mouvement latéral, systèmes de régulation."
GMC758,Turbines à gaz et propulsion,"S'initier à la conception et au fonctionnement de la turbine à gaz en   tant que propulseur d'avion. Étude approfondie des cycles réels, combustion. Aérodynamique des   compresseurs, des turbines et des entrées d'air. Étude de la propulsion   par hélice, par réaction et postcombustion. Aperçu de la technologie et   des procédés de fabrication."
BGE721,Modélisation en conception d’instruments médicaux,"Déterminer les comportements et propriétés biologiques pertinents pour le fonctionnement d’un instrument médical. Choisir et mettre en œuvre des techniques de modélisation du vivant et de traitement des signaux pour la conception d’un instrument médical. Valider le fonctionnement d’un instrument médical et les techniques associées dans un environnement contrôlé. Éléments d’anatomie et de physiologie; comportement mécanique ou électrique des tissus biologiques ou organes; modélisation linéaire et non linéaire en bio-ingénierie; détermination de paramètres d’un modèle du vivant; traitement avancé de signaux biomédicaux (représentation par ondelettes, décomposition modale empirique (EMD), filtrage adaptatif); introduction à l’imagerie biomédicale."
