Course Number,Course Name,Course Description
IMC100,Mathématiques de l'ingénieur I,"Être apte à manipuler les concepts mathématiques pertinents aux compétences  Lois de conservation des milieux continus  et  Maîtrise de l'outil expérimental et systèmes mécatroniques ; inculquer des notions de statistique et de probabilités pour planifier les expériences et pour décrire et analyser les résultats expérimentaux. Variables complexes : opérations élémentaires; forme polaire; exponentielle complexe. Transformée de Laplace: modélisation d'un système mécanique; transformée de Laplace et propriétés; application à la résolution d'E.D. linéaires; représentations temporelle/fréquentielle d'un système. Analyse vectorielle : opérateurs vectoriels; intégrales de ligne, de flux; théorèmes intégraux. Statistique descriptive, modélisation statistique, estimations, prédictions et tests d'hypothèses, plans d'expériences."
IMC106,Résistance des matériaux I,"Présenter les concepts fondamentaux de la mécanique des milieux continus appliquée aux solides; intégrer ces notions avec les apprentissages provenant des mathématiques, des lois de comportement, de l'informatique et de la méthode expérimentale; contextualiser les concepts de la mécanique des solides afin de comprendre le sens physique des phénomènes rencontrés en mécanique des solides et d'acquérir les aptitudes nécessaires à la modélisation de problèmes pratiques. Notions de contraintes et de déformations. Transformation des contraintes et des déformations, mesures des déformations. Relations contraintes/déformations/température. Calcul des contraintes et des déformations de structures mécaniques simples sous sollicitations simples et composées. Notions de fatigue."
IMC113,Résistance des matériaux II,"Calculer les contraintes d’une poutre fabriquée par assemblage ou hétérogène, et pour le cas de flexion gauche; calculer la flèche et la pente d’une poutre par les méthodes de double intégration et des fonctions de singularité; calculer les efforts internes d’une poutre supportant une charge mobile; calculer les déplacements et contraintes associés au chargement de torsion pour un tube à paroi mince de section fermée non circulaire et pour les sections ouvertes minces; utiliser la méthode des éléments finis pour le calcul des déplacements, déformations et contraintes d’une structure sous chargement statique; et calculer la charge critique de flambement d’une colonne. Flexion avancée : fonctions de singularité, charge mobile, poutres fabriquées par assemblage, poutres hétérogènes et flexion gauche; torsion avancée : tubes à paroi mince de section non circulaire et sections ouvertes minces; méthode des éléments finis en calcul des structures : introduction à un logiciel d’éléments finis et laboratoires; et instabilité et flambement : stabilité d’une membrure rigide, stabilité d’une membrure élastique en compression, formule d’Euler, colonne « rotule-rotule » soumise à une charge excentrée et déversement latéral des poutres."
IMC117,Mathématiques de l'ingénieur II,"Reconnaître les différentes classes de problèmes aux limites rencontrées en mécanique; appliquer les techniques numériques de résolution (différences finies et éléments finis); appliquer la transformée de Laplace et les équations aux dérivées partielles. Classification des équations aux dérivées partielles de la mécanique : ordre 1, ordre 2; elliptiques paraboliques, hyperboliques; conditions aux limites; conditions initiales. Résolution numérique des EDP elliptiques : équation de Laplace; de Poisson; différences finies; problèmes 1D, 2D, 3D. Résolution numérique des EDP paraboliques : différences finies explicites, implicites; problèmes 1D, 2D. Résolution numérique des EDP hyperboliques : équation d'onde, différences finies, problèmes 1D, 2D. Introduction à la méthode des éléments finis. Application de la transformée de Laplace au contrôle et à la mécatronique. Introduction aux équations aux dérivées partielles."
IMC152,Résistance des matériaux III,Définir les principes et notions de base en résistance des matériaux; connaître le concept d'énergie de déformation et le théorème de Maxwell-Betti; démontrer et appliquer le théorème de Castigliano; appliquer le principe du déplacement virtuel et le principe des forces virtuelles; appliquer les théories de limitations en fatigue; calculer les déplacements et les contraintes pour des corps axisymétriques; calculer les contraintes associées à la flexion de poutres courbées; connaître les notions de base relatives au calcul d’un joint boulonné; et connaître les notions de base relatives au calcul du facteur de sécurité. Rappel des notions fondamentales en résistance des matériaux; méthodes énergétiques en résistance des matériaux; théories de limitations en fatigue; corps axisymétriques; poutres courbées; joints boulonnés; et facteur de sécurité.
IMC211,Dynamique des fluides appliquée,"Développer les compétences nécessaires pour l'analyse et la modélisation des écoulements permanents et non permanents et les appliquer aux cas de la couche limite, de la lubrification et des écoulements compressibles. Notions complémentaires : volume de contrôle en mouvement et bilans. Couches limites : laminaire, turbulente; transition et décollement. Équation de Van Karman. Écoulements dominés par viscosité : lubrification, équation de Reynolds, patin incliné et butée de Mitchell, écoulement de couette et palier lisse, instabilités et cavitation. Écoulements compressibles d'un gaz parfait : vitesse du son, nombre de Mach, écoulements isoénergétiques et ligne de Fanno, écoulements isentropiques, onde de choc normale et lignes de Fanno et de Rayleigh. Écoulements avec friction. Onde de Prandtl-Meyer et onde de choc oblique."
IMC221,Transferts thermiques,"Développer les compétences nécessaires pour l'analyse des phénomènes de transmission de chaleur par conduction, par convection et par rayonnement. Phénomènes de transmission de chaleur. Concepts fondamentaux. Conduction en régimes permanent et transitoire. Conductions unie et multidimensionnelle. Applications. Convections forcée, naturelle et mixte. Écoulements externes et internes. Corrélations. Applications. Échangeurs de chaleur. Loi de transfert par rayonnement. Rayonnement entre surfaces noires et grises. Transmission de chaleur mixte. Applications."
IMC501,Simulation numérique appliquée,"Faire la synthèse des sciences fondamentales du génie par la résolution d'un problème de complexité moyenne, tel que ceux rencontrés dans la pratique de l'ingénierie; développer une compétence en analyse et modélisation numériques afin de prédire d'une façon fiable le comportement d'une structure ou d'un système mécanique réel; maîtriser une procédure d'analyse reposant sur des approches analytiques et numériques. Présentation des méthodes numériques d'éléments finis. Présentation d'une procédure d'analyse numérique. Présentation, décortication et utilisation d'un logiciel d'analyse numérique par éléments finis."
IMC510,Introduction au génie-qualité,"Réaliser l'importance de la qualité dans le contexte industriel actuel; maîtriser les techniques de base en génie-qualité; développer des compétences en analyse et résolution de problèmes en qualité. Compléments de statistiques. Définition et importance de la qualité. Nouvelles approches de la qualité : fonction de perte de Taguchi, assurance de la qualité, gestion totale de la qualité, cercles de qualité, intégration de la qualité. Diagnostic et amélioration des produits et des procédés : analyses de Pareto, diagramme d'Ishikawa, techniques de résolution de problèmes. Contrôle statistique des procédés SPC : études et indices de capacité, cartes de contrôle pour mesures et pour attributs, analyse des tendances. Contrôle statistique des produits : plans d'échantillonnage simples, doubles et multiples pour attributs, paramètres et courbes caractéristiques, méthodes de sélection, normes ANSI/ASQC Z1.4, plans Dodge-Romig et zéro défaut, plans d'échantillonnage pour mesures, méthodes k et m, sigma connu et sigma inconnu, normes ANSI/ASQC Z1.9. Exemples industriels, systèmes informatisés."
ING100,Algèbre linéaire,"Formuler les problèmes en utilisant les notions de vecteurs et de matrices. Choisir et appliquer les outils appropriés pour résoudre les systèmes linéaires et les problèmes aux valeurs propres. Vecteurs et matrices; exemples; opérations sur les vecteurs; opérations sur les matrices; sous-espaces vectoriels; indépendance linéaire; base, applications. Transformations linéaires : exemples; noyau et image d'une transformation linéaire; applications. Systèmes de n équations linéaires à n inconnues : exemples; méthode d'élimination de Gauss; existence et unicité d'une solution; méthode de la matrice inverse; déterminant et règle de Cramer; techniques numériques; méthode des moindres carrés; applications. Valeurs propres et vecteurs propres : exemples; équations caractéristiques; diagonalisation; techniques numériques d'approximation des valeurs propres; applications."
ING112,Équations différentielles et calcul intégral en génie,"Développer ses aptitudes à utiliser les techniques du calcul   différentiel et intégral pour modéliser et résoudre les problèmes du   génie. Techniques élémentaires de l’analyse, calcul vectoriel et intégral,   équations différentielles et modélisation en génie, équations   différentielles du premier ordre, équations différentielles et systèmes   d’équations différentielles linéaires d’ordre n, intégrales multiples."
ING225,Statique,"Développer les compétences requises pour appliquer les lois fondamentales de l'équilibre dans l'espace bidimensionnel et tridimensionnel. Introduction à la statique, force, couple et moment, équilibre, structures et mécanismes, charges réparties, efforts internes et énergie de déformation, frottement, travail virtuel."
ING250,Exploitation de l'ordinateur I,"Rendre les étudiantes et les étudiants autonomes avec les technologies informatiques de base et développer la capacité d'abstraction et l'habileté requise à la programmation et à la résolution de problèmes avec l'ordinateur. Logiciel d'exploitation et lien Internet, concepts de programmation structurée et traduction en Matlab (les données, les instructions élémentaires, les opérations, les structures (séquence, décision, boucle) et les méthodologies de résolution de problèmes simples en mathématiques et en génie)."
ING259,Exploitation de l'ordinateur II,"Se familiariser avec les techniques informatiques de base, développer la capacité d’abstraction et l’habileté requises pour la programmation et la résolution de problèmes. Formation pratique sur les vecteurs et les matrices, outil symbolique, infographie et types de données, techniques classiques de calcul numérique, éléments de génie logiciel, programmation graphique (LabView)."
ING260,Dynamique,"Développer les capacités de l'étudiante ou de l'étudiant afin qu'il puisse prédire les effets des forces et du mouvement pour modéliser, analyser, concevoir et contrôler des systèmes mécaniques dans l'espace tridimensionnel à l'aide d'une approche basée sur la conservation de la quantité de mouvement ou une approche énergétique. Analyse vectorielle de la cinématique des particules : vitesse et accélération dans différents repères. Notions d'inertie et d'équations constitutives de composantes dynamiques. Diagramme du corps libre. Cinétique des particules. Cinématique et cinétique de solides dans le plan et en trois dimensions. Moments et tenseurs d'inertie. Introduction à l'analyse dynamique de systèmes à multi-composantes par approche énergétique et graphes de liens. Application à des systèmes vibratoires discrets."
ING316,Introduction à la thermodynamique,Développer des compétences en vue d'analyser divers systèmes thermodynamiques discrets en recourant aux première et deuxième lois de la thermodynamique. Énergie : formes et conversion. Propriétés des substances pures. Première et deuxième lois de la thermodynamique. Entropie. Applications.
ING400,Mécanique des fluides,"Initier l'étudiante ou l'étudiant à l'analyse et la modélisation des écoulements fluides par la méthode des bilans sur un volume contrôle et par la méthode des nombres sans-dimension; intégrer les lois de comportement à la modélisation; intégrer l'approche expérimentale et des systèmes à la modélisation; appliquer la méthode des bilans aux cas des fluides au repos et en mouvement permanent; développer la compétence de modaliser un réseau et de choisir les machines hydrauliques (pompes) (utilisation du logiciel Watcad). Concepts généraux : milieu continu, densité, pression, viscosité, pression de vapeur, compressibilité et tension superficielle. Contraintes pour un fluide : pression et frottement tangentiel (loi de viscosité de Newton). Système thermofluides : rôle et convention de schématisation. Analyse et modélisation : analyse dimensionnelle et similitude, approches intégrale et différentielle, bilans de masse, d'énergie et de momentum linéaire. Application de bilans pour les fluides au repos : loi de Pascal, variation de la pression, force sur une paroi, principe d'Archimède, manométrie et mesure de pression. Application de bilans et de l'analyse dimensionnelle aux fluides en mouvement : écoulements internes, externes, laminaires, turbulents, développés. Concepts de perte de charge, vitesse moyenne, coefficient d'énergie cinétique, diamètre hydraulique, systèmes et machines hydrauliques, réseaux. Mesures de débit et de vitesse."
IMC122,Éléments et systèmes mécaniques,"S'initier aux éléments et systèmes mécaniques et électromécaniques, connaître le rôle des différents composants et appliquer la méthodologie appropriée à leur analyse, interpréter les règles principales de montage et d'ajustage mécanique, comprendre les principes de fonctionnement de systèmes mécaniques et électromécaniques les plus couramment employés; se familiariser avec différents outils et techniques de montage et démontage de ces systèmes. Éléments d'assemblage mécanique : vis, boulons, écrous. Éléments de transmission de puissance: arbres, engrenages, courroies. Paliers à glissement, paliers à éléments roulants. Ressorts. Les accouplements, freins et embrayages, transformations des mouvements. Éléments de systèmes (électro) pneumatiques et (électro) hydrauliques. Éléments et/ou organes de moteurs à combustion interne à pistons, de systèmes de suspension et de freinage, de machines thermiques et électriques. Pompes, valves, soupapes. Terminologie."
IMC155,Création de produits innovants,"Comprendre les environnements, attitudes, pratiques et processus qui favorisent la pensée créative et la pensée critique; appliquer le processus créatif; développer en équipe un produit innovant dans un contexte d’entrepreneuriat technologique; développer des compétences entrepreneuriales. Pensée créative; techniques de créativité; processus créatif de résolution de problème; idéation entrepreneuriale; marché et besoins des clients; observations et entrevues; canevas de modèle d’affaires et proposition de valeur; processus de développement de produits; analyse fonctionnelle; techniques de conception pour l’élaboration de stratégies et de concepts; introduction à la conception détaillée de modules et composantes simples; gestion de projet; prototypage d’un produit innovant; argumentaire entrepreneurial."
IMC310,Microstructures et choix des matériaux,"Comprendre l'impact de la microstructure des matériaux sur leurs propriétés; connaître les principes directeurs des principales méthodes de fabrication et de modification des propriétés des matériaux; planifier un traitement thermique pour le durcissement d'un métal; calculer les propriétés élastiques et de rupture d'un composite simple; développer une connaissance intuitive des propriétés d'un matériau; effectuer le choix d'un type de métal en se basant sur les essais de Jominy; effectuer un choix de matériau à l'aide d'une méthode objective et quantitative; inclure la géométrie dans le choix des matériaux. Processus de conception. Liaisons chimiques et microstructures. Méthode de durcissement des métaux. Graphiques isothermes. Rudiments de chimie organique. Polymères : types, propriétés, fabrication de polymères. Microstructure des céramiques. Argiles. Céramiques réfractaires. Classification des matériaux. Base de données de matériaux, initiation à CES, choix de matériaux, indice de performance, facteur de forme."
IMC326,Systèmes mécatroniques analogiques,"Définir un système mécatronique et en identifier les composants, modéliser et analyser un système mécatronique, concevoir l'asservissement d'un système mécatronique et réaliser un asservissement en prototypage rapide. Introduction sur les systèmes mécatroniques, capteurs analogiques, actionneurs, modélisation des systèmes, systèmes dynamiques bouclés, correcteur PID (proportionnel, intégral, dérivé), analyse fréquentielle, et filtrage analogique."
IMC350,Fiabilité des matériaux,"Analyser les processus de dégradation des matériaux; approfondir les notions théoriques et appliquées sur les problèmes de défaillance d'origine mécanique ou physicochimique (rupture, corrosion, vieillissement, fatigue, fluage, etc.), afin de faire un choix rationnel et sécuritaire des matériaux, d'apporter des solutions optimales pour la conception et la production, de minimiser la dégradation, de prévoir et prolonger la durée de vie des systèmes mécaniques; prévoir la durée de vie des pièces mécaniques selon les conditions d'utilisation en service; choisir une méthode de prévention de la dégradation et de la défaillance de différents matériaux. Introduction à l'analyse des défaillances, définition des modes de rupture. Rappel sur l'élasticité et la rupture ductile, rupture brutale, ténacité, fatigue des matériaux, notions de la mécanique de rupture et comportement en fatigue des pièces fissurées, déformation et rupture par fluage, oxydation, corrosion aqueuse, méthodes de prévention de la corrosion, frottement, abrasion et usure. Étude de cas de rupture de pièces et de structures d'ingénierie. Projet d'expertise et d'analyse de la rupture d'une pièce."
IMC400,Introduction aux techniques d'usinage,"Acquérir des connaissances fondamentales théoriques et pratiques sur les machines-outils et les techniques d'usinage. Machines-outils et coupe des métaux, forces de coupe et puissance, matériaux d'outils de coupe, économie de l'usinage, usinabilité. Usinage par abrasion, procédés d'usinage."
IMC405,Procédés de mise en forme des matériaux,"Acquérir des connaissances fondamentales sur les principaux procédés concernant la fabrication des pièces mécaniques; comparer les différents procédés de mise en forme; être capable de sélectionner le procédé approprié selon la situation. Critères de choix d'un procédé de fabrication, tolérances dimensionnelles et ajustements, tolérances géométriques. Procédés de fabrication par fonderie et métallurgie des poudres. Procédés d'assemblage par soudage et brasage. Mise en forme des métaux et leurs alliages par déformation plastique. Mise en forme des polymères et des composites. Étude de cas en fabrication. Étude expérimentale d'investigation sur le procédé de fabrication d'une pièce métallique."
IMC451,Systèmes mécatroniques numériques,"Décrire le fonctionnement des différents composants d'un système mécatronique, choisir les capteurs, les actionneurs et les circuits d'interface appropriés à une application mécatronique, programmer un automate industriel et un microcontrôleur pour piloter une application mécatronique, et concevoir un filtrage et une commande numérique en temps réel. Introduction sur les systèmes mécatroniques, capteurs binaires, actionneurs binaires, commande logique, commande en logique séquentielle, Grafcet, capteurs numériques, commande d’actionneurs, microcontrôleurs, signaux discrets, filtrage numérique, système bouclé numérique."
IMC455,Projet de mécatronique,"Concevoir l'intégration de chacun des sous-systèmes d'une application mécatronique dans le cadre d'un projet de conception multidisciplinaire réalisé en équipe. Dans le contexte industriel actuel, une quantité grandissante de produits et de procédés (imprimantes, freins ABS, ligne de production automatisée, etc.) intègrent des composantes mécaniques, électroniques, logicielles et de contrôle. Dans le projet de mécatronique, cette intégration est réalisée par la séquence d'étapes suivantes : présentation du projet, prototypage - mécanique et capteur; prototypage - actionneur; prototypage - informatique; présentation finale."
ING211,Dessin technique,"Produire et lire des dessins techniques de pièces et d'assemblages en trois dimensions respectant les règles de l'art, à la main ou sur un logiciel de conception assisté par ordinateur (CAO), développant ainsi ses perceptions spatiales et ses moyens de communication écrite. Définitions et conventions de base, représentation conventionnelle des formes (projections orthogonale, isométrique et oblique), vues auxiliaires, vues en coupe, règles de cotation, tolérances et ajustements (tolérances dimensionnelles et géométriques), représentation et codification des filetages et autres éléments de fixation, et dessin de définition (dessins de détail, d'assemblage et d'aménagement)."
ING301,Introduction aux matériaux,"Présenter les familles de matériaux et leur profil. Relier le comportement des grandes classes de matériaux à la structure et à l'architecture atomiques. Déduire les phases et leur proportion à l'aide des diagrammes d'équilibre. Essai de traction, dureté, fatigue. Diagramme de propriétés, rigidité, résistance, ductilité, ténacité, indice de performance. Liaison, architecture atomique, métal, plastique, céramique. Forme cristalline et amorphe, cristallographie, défaut, dislocation, solution solide, diagramme d'équilibre binaire, alliage, acier, microscopie. Transition ductile-fragile."
ING321,Éléments de la méthode expérimentale,"Utiliser la méthode expérimentale pour réaliser des mesures dans des situations concrètes; analyser et utiliser des circuits électriques simples; représenter et analyser des signaux et des systèmes dynamiques dans le domaine fréquentiel. Systèmes de mesure : systèmes d'unités, analyse dimensionnelle, système de mesure généralisé, erreurs de mesure et incertitudes sur les mesures; éléments d'électricité : circuits résistifs, circuits réactifs et composantes électriques (conversion analogique-numérique, séries de données numériques, actionneurs, capteurs, etc.); analyse spectrale et fonctions de transfert; laboratoires."
ING525,Santé et sécurité du travail,"Développer une compétence dans l'identification et la correction des risques et des dangers vis-à-vis de la santé ou la sécurité en milieu de travail. Importance et évolution de la SST. Responsabilité légale et professionnelle. Lois et règlements. Gestion de la santé et sécurité au travail. Programme de prévention. Santé au travail, ergonomie et hygiène industrielle. Travaux de construction. Sécurité des machines et des procédés. Intervention à la suite d'un accident."
GIN600,Analyse économique en ingénierie,Acquérir les notions fondamentales sur les opérations financières d'une entreprise ainsi que les concepts et techniques d'analyse de rentabilité des investissements industriels. Notions fondamentales de comptabilité. États financiers. Notion d'intérêt et actualisation de l'argent. Critères de rentabilité. Techniques d'analyse de rentabilité : évaluation et sélection des projets d'investissements. Détermination des flux monétaires. Impôts et analyse de rentabilité.
ING500,Communication technique,"Développer une compétence qui permettra à l'étudiante et à l'étudiant: de réaliser l'importance de la communication en ingénierie; d'être apte à corriger ses fautes d'orthographe, de grammaire et de syntaxe; de rédiger des textes clairs et bien structurés, de trouver l'information pertinente; de mettre en valeur ses écrits par un support visuel approprié; de maîtriser la rédaction des écrits propres à la fonction d'ingénieur; de faire des présentations orales concises et claires; de bien réussir une entrevue. La mise en contexte. La forme: maîtrise de la langue française. Le fond: savoir écrire pour être lu et compris. La recherche d'information. La visualisation. Les écrits spécifiques. L'exposé oral. L'entrevue."
