Course Number,Course Name,Course Description
MEE417,Introduction to Biomechanics,"Biomechanics consists of the application of mechanical principles to human or animal bodies in movement or at rest. This introductory course to biomechanics aims at providing the student with notions and principles of biomechanics with specific applications to the modeling of the musculoskeletal system. Among the topics covered, one finds the introduction to the functional anatomy, the kinematic and dynamic modeling of the human body in movement, the anthropometric models and the modeling of the mechanical behaviour of some tissues."
MEE423,Applied Heat Transfer,"This course covers concepts of heat transfer as they apply to engineering. Topics include, free and forced convection, boiling and condensation, thermal radiation exchange between surfaces, and combined heat transfer as it applies to HVAC. These heat transfer concepts are approached analytically and numerically, and semi-empirical correlations are also discussed. The coupling between the hydrodynamic and thermal fields is underlined in the case of free or mixed convection. The engineering applications that are considered are: Cooling in nuclear reactors and gas turbine blades and conceptual Design of heat exchangers. Solar power generators for space vehicles are also studied."
MEE425,Renewable Energy,"The aim of this course is to examine renewable energy sources and generation systems and the impact of their use on the environment. The course includes the study of different technologies used to harness natural energy. Examples studied are: Thermal and photovoltaic solar, wind, tidal and geothermal energy. This course applies concepts learned in fluid dynamics and heat transfer. Projects on solar and wind energy are undertaken during the term."
MEE435,Experimental Techniques in Materials Engineering,"This is a course on the measurement of mechanical properties of engineering materials. Emphasis is placed on precise measurement and application of relevant standard test methods for material properties. Lecture material covers the microstructure - material behaviour interactions, data reduction techniques and statistical analysis. Students develop their knowledge and skills in material behavior, experimental techniques, data analysis, and technical report writing."
MEE437,Robot Dynamics and Control,"This course covers the following topics: Classification of robot manipulators, Homogeneous Transformations, Euler Angles, Denavit Hartenberg Convention, Forward and Inverse Kinematics. Manipulator Jacobians, Robot Dynamics, Design of joint actuating systems, Independent joint control, Point-To-Point control, Path planning and trajectory control, Sensory components for robot control, Space application of robotic systems."
MEE438,Applied Process Control,"Main topics: Control loops, design of control systems, real aspects, and digital control concepts."
MEE446,Introduction to Micro-and Nano-Engineering,"This course will introduce students to fundamental principles governing fluids and materials at the small scale. Microfabrication techniques, such as plasma-based etching and deposition, of microscale and nanoscale elements will be investigated and illustrated for relevant mechanical and aerospace engineering applications. The small scale elements can also be assembled into more complex systems: a course project will consider the design of selected mechanical engineering applications (e.g.: micro-pump; micro-motor; micro heat-exchanger). Nano-motors and nano-machines will also be studied."
MEE451,Combustion Engines,"After a review of basic thermodynamic and combustion principles necessary for studying the topics of interest, the lectures consider the design and operation of spark-ignition, Diesel, and gas turbine engines. Some of the topics studied are: fuel and ignition systems; supercharging, combustion chambers; properties and performance of fuels; sources and control of air pollution; alcohol, hydrogen, and other non-conventional fuels. The lectures are supplemented by assignments and laboratory experiments."
MEE469,Marine Systems Engineering,"This course considers the main engineering issues involved in the design and operation of ships. The topics studied include: hull design for surface ships and submarines, including drag and stability; selection and performance of propulsion engines, including diesels, gas turbines and electric propulsion; propellers and water jet drives; generation and control of on-board electricity; weapon systems; and life support systems. The course is focused on the fundamental principles that drive the design of the systems studied, but also discusses recent technology and future developments."
AEE435,Aerodynamics of Aircraft Designed for Supersonic Flight,"This course builds on the material developed in the study of compressible flow to analyze high speed flight. The topics covered include applications such as supersonic intakes and nozzles, oblique shock waves and their reflections, airfoil and fuselage designs for transonic flight. The course emphasizes applications of the principles of compressible flow to high speed aircraft design. The course also covers some aspects of hypersonic flight. The lectures are supplemented by assigned problems and projects."
AEE461,Aeronautical and Space Propulsion,"This course illustrates the application of the fundamental principles of fluid mechanics and thermodynamics to the analysis of present-day and proposed propulsion systems. Students will be able to model and analyze propellers, turbojets, turbofans, turboprops and their associated components including compressors and turbines. Furthermore they will understand ramjets and propulsion fundamentals of rockets are also discussed. The lectures are supplemented by assigned exercises and laboratory problems in related areas."
AEE463,Aeroelasticity,"Aeroelasticity is the discipline that deals with the interaction of elastic structures and aerodynamic loads. The main objective of this course is to provide the student with the knowledge of basic principles in aeroelasticity, while some typical applications are also studied. Three archetypes of aeroelastic stability problems are then discussed in detail, namely divergence, classical or coupled flutter and stall flutter. As part of these discussions, unsteady aerodynamics and few nonlinear dynamics concepts are covered. In the last part of the course the aeroelastic response to gust and atmospheric turbulence is presented. Finally, aspects of vortex-induced vibrations are discussed. The understanding of the material is strengthened via the application by the students of a balanced mix of analytical work, numerical simulations and wind tunnel testing."
AEE467,Rotary Wing Aircraft,"This course examines attributes and characteristics of rotary wing aircraft which are capable of vertical takeoff and landing and which utilize the rotor to produce forward thrust. Topics include hovering, horizontal and vertical flight, actuator disc and blade element theories of rotor performance, flow patterns (including ground effect) in various flight regimes, rotor dynamics and control, autorotation, tail rotor aerodynamics and gyroscopic effects, single rotor helicopter performance. Other topics include methods for evaluation of power requirements and fuel consumption, and analysis of simple missions."
AEE491,Maintenance Management,"This course investigates the requirements, design and implementation of effective aircraft maintenance programs. Topics include the objectives of a maintenance plan in meeting the requirements of operational and technical airworthiness; various elements of maintenance plan development; and considerations for effective implementation of preventive maintenance programs. Detailed reviews of component lifting methodologies, preventive maintenance concepts such as failure analysis, condition-centered and reliability centered maintenance, logic driven maintenance scheduling, and level of repair analysis methodologies are supplemented by case study assignments."
