Course Number,Course Name,Course Description
MECH-3831,Thermodynamics and Kinetics of Materials,"Thermodynamics: review of First and Second Laws, gas laws, humidity, thermochemistry, entropy, reversible and irreversible processes, equilibrium criteria, Gibbs free energy, activity and activity coefficient, solution thermodynamics, Raoult's and Henry's Laws, Gibbs-Duhem equation, alloy phase equilibria, free energy-composition diagrams, Ellingham diagrams.  Kinetics: empirical treatment for homogeneous reaction rates, reaction order and specific rate constant, activation energy, Arrhenius' Law, energy distribution in reacting systems, heterogeneous reactions. Selected problems in materials processing to illustrate theory.(Prerequisites: MECH-3212 and Semester 7 or higher standing.)(3 lecture, 2 laboratory hours a week.)"
MECH-4820,Ceramic Materials,"Uses of traditional and advanced ceramics. Monolithic and composite ceramics. Comparison of ceramics with metals and alloys. Processing: raw material preparation, forming techniques, theory and practice of sintering, quality control. Properties: modulus of rupture, creep, corrosion, erosion, and electrical, magneticand optical properties.(Prerequisite: Semester 7 or higher standing.)(3 lecture hours, 1 laboratory hours a week.)"
MECH-4821,Deformation and Fracture,"Introduction to basic plasticity theory and its application to common metal forming and metal cutting processes. Fracture mechanics and its applications in brittle and ductile fracture, creep and fatigue, for purposes of design and of analysis."
MECH-4832,Modern Steels,"Traditional and advanced high strength steels.  Automotive sheet steels.  Stainless and tool steels.  Cast irons.  Steel industry in Canada.  Mechanical and microstructural characterization laboratories.(Prerequisite: Semester 7 or higher standing.)(3 lecturehours, 1 laboratory hour a week.)"
MECH-4834,Polymers,"The structure, properties, and processing of polymers (plastics) with emphasis on polymer forming processes, including extrusion, injection molding, blowmolding, and thermoforming, including tours of local industry. Fabrication and properties of composites with a polymer base."
MECH-4840,Topics in Materials Engineering,"Selected topics of current interest in Materials Engineering. (Prerequisites:Semester 7 or higherstanding or permission of instructor.) (3 lecture, 1 laboratory hours a week.)"
MECH-4841,Directed Studies in Materials Engineering,A special course of studies in Materials Engineering with content and direction approved by the DepartmentHead. (Prerequisites:Semester 7 or higherstanding with a70%
MECH-4850,Welding Engineering,"Design and qualification of arc welding procedures to met the requirements of the ASME Boiler and Pressure Vessel Code.  Arc welding processes, weld discontinuities, mechanical and non-destructive testing.  Welding metallurgy, base and filler metal classification.  Control of hydrogen-assisted cracking, preheat and postweld heat treatment.  Fabrication issues. Canadian and international welding codes.   (Prerequisite: Semester 7 or higher standing.)(3 lecture, 1 laboratory hours a week.)"
MECH-3670,Aerospace Engineering Fundamentals,"History of flight and aircraft evolution.  Aircraft operating principles.  Airfoil and wing aerodynamics.  Aerospace propulsion systems (turbojets, turbofans, turboprops, and rockets).  Lab on performance estimation and measurement for a turbojet engine.  Aircraft design.  Weight estimation.  Aircraft systems.  Aircraft materials and structures.  Governance of aviation in North America.  Design studies of aircraft or spacecraft and/or components thereof. (Prerequisites: MATH-2780, MATH-2790, semester 6 or higher standing; and  Aerospace option students or permission of instructor.) (Co-requisites: MECH-3217, MECH-3220.)"
MECH-3671,Aerospace Materials and Manufacturing,"Properties and selection of metals, ceramics, polymers, and composite materials for aerospace applications. Structural and gas-turbine alloys. Machining, casting, forming, heat treating, and joining processes for original manufacture and repair. Manufacture and application of composites. In-service materials degradation. (Pre-requisites:"
MECH-4670,Aerospace Propulsion,"Application of gas dynamics and thermodynamics to aerospace engines. Analysis of engine cycles. Theory and design of propellers; turboprop engine analysis, Internal combustion and gas turbine engines. Component design for compressors, combustors, afterburners, exhaust nozzles. (Pre-requisites:"
MECH-4671,Aerodynamics and Performance,Analysis of aircraft configurations.  Viscous and compressibility effects.  Manoeuvering loads and load factors; implications of manoeuverability on thrust requirements.  Aircraft stability and control.(Pre-requisites:
MECH-4672,Flight Dynamics and Control of Unmanned Aerial Vehicles,Flight dynamics modelling for fixed-wing aircraft and rotorcraft.  Low-Reynolds number considerations applicable to unmanned aerial vehicles (UAVs).  Control theory and state-space control schemes.  State-space controller design for UAVs.  Lab(s) involving control of virtual and/or physical UAV models. (Pre-requisites: MECH-3670 and MECH-4671)
MECH-4469,Diesel Engine Fundamentals,"Theory and practice of modern diesel engines. Diesel combustion cycle. Engine design aspects including fuel injection, turbocharging, and intercooling. Measurement and control of engine emissions. Engine performance testing. Future and advanced technologies including exhaust aftertreatment. (Prerequisites:"
