Course Number,Course Name,Course Description
APSC 193,Anatomy and Physiology for Engineers,"Structure and function of the neuromuscular, skeletal, digestive, endocrine, urinary, circulatory, and respiratory systems of the human body. Special emphasis on interfacing with biomedical devices. [3-2-0]"
ENGR 351,Microelectronics I,"Signals and amplifier fundamentals, the operational amplifier, diodes, metal-oxide-semiconductor field effect transistor amplifier circuits, and bipolar junction transistor amplifier circuits. [3-2*-0] Prerequisite: APSC 255."
ENGR 401,Bioinstrumentation,"Bioinstruments used for tracking vitals, diagnosis, and treatment of disease in the vascular, muscular, nervous, and respiratory systems. Introduction to the fundamentals of each body system, electrical safety, signal acquisition, biosensors, transducers, amplifiers, and analysis of human physiological measurements. Hands on experience with sensors, biomedical devices, and design through labs. [3-2*-0] Prerequisite: All of APSC 193, APSC 254."
ENGR 402,Biotechnology: Fundamentals and Applications,"Basics of biotechnology, DNA and RNA technologies, nanobiotechnology, medical biotechnology, and ethics in biotechnology. [3-0-0] Prerequisite: Third-year standing"
ENGR 406,Microelectromechanical Systems,"Mechanisms, design, fabrication, and testing of microsensors, actuators, and MicroElectroMechanical systems (MEMS).  Credit will not be granted for both ENGR 406 and ENGR 506 [3-2*-0] Prerequisite: Fourth-year standing in the B.A.Sc. Program"
ENGR 423,Wearable Devices,"Design and prototyping including textiles, hardware, software, data storage, miniaturization, wireless communication, power, environment, and fabrication. Analysis of wearable technologies and challenges of mass adoption. [3-2*-0] Prerequisite: ENGR 401."
ENGR 450,Clinical Engineering,"The clinical environment, clinical tools (for screening, diagnostics, treatment, monitoring, and rehabilitation) and regulatory requirements. [3-2*-0] Prerequisite: APSC 193 and fourth-year BASc standing."
ENGR 482,Biomedical Engineering I,"Introduction to the microcirculation; gas exchange in organs, including diffusion, perfusion and ventilation; surface energy in biological systems; principles of hemodynamics including vascular resistance and flow regimes at different levels of organs, tissues and cells; principles of tissue mechanics; introduction to tissue engineering; introduction to medical devices design and development. [3-0-0] Prerequisite: Fourth-year standing"
ENGR 499,Engineering Capstone Design Project,A capstone design project in response to an actual engineering problem. The project can be multi-disciplinary or in a specialized area of engineering. Students are required to submit a comprehensive project report and deliver a formal presentation. [2-3-0; 0-6-0] Prerequisite: Fourth-year standing.
