Course Number,Course Name,Course Description
AERO 401,Introduction to Aerospace Engineering,"AERO : Basic concepts in all relevant aspects of aerospace engineering. Introduction to aircraft and spacecraft components, systems and operation. Aerodynamic and flight mechanics. Structures and materials. Propulsion systems. Manufacturing processes. Control and systems. Avionics and navigation."
AERO 410,Aerospace Design and Certification Process,"AERO : Design and certification process for aircraft, helicopters and spacecraft. Operation and performance requirements. Preliminary and detailed design process. Performance analysis. Regulatory agencies overview. Certification process. Life cycle analysis. Cost analysis. Flight testing programs. Delivery and operation."
AERO 460D1,Aerospace Project,"AERO : Application of the material learned in other courses in the Minor in Aerospace Engineering to an applied project. Team project work will involve the design, fabrication, verification, and application of an aerospace system / component. Lectures on topics related to design and management of design projects. Emphasis is on the completion of a project of professional quality in collaboration with the aerospace industry."
AERO 460D2,Aerospace Project,AERO : For description see AERO 460D1.
ARCH 303,Design and Construction 1,"Architecture : An exploration of the design of buildings. Projects emphasize the major social, technological, environmental, and symbolic aspects of the design process. Introduction to specific modelling, presentation, and documentation techniques. Discussions, readings, field trips and practical exercises."
ARCH 304,Design and Construction 2,"Architecture : Continuation of Design and Construction I with projects of increasing complexity. Projects deal with particular aspects of architectural design and/or explore approaches to design methodology. Discussions, readings, field trips and practical exercises."
ARCH 321,Freehand Drawing 3,Architecture : Continuation of ARCH 218. Refinement of graphic skills and visual literacy through exercises in life drawing. Introduction to the materials and methods of watercolour painting.
ARCH 322,Freehand Drawing 4,"Architecture : Synthesis of ARCH 217, 218 and ARCH 321. Further refinement of graphic skills and visual literacy through exercises in life drawing. Students select and combine various media and apply them to diverse drawing and painting surfaces."
ARCH 324,Sketching School,Architecture : An eight-day supervised field trip in the late summer to sketch places or things having specific visual characteristics. Students are required to include Sketching School I in the B.Sc.(Arch.) program.
ARCH 325,Architectural Sketching,"Architecture : Seven days of supervised field sketching in selected locations outside Montreal. The course develops traditional skills in architectural sketching in pencil, ink and watercolour. Sketching is explored as a process that frames the student's encounter with the environment and as a strategy for acquiring knowledge and understanding of the world."
ARCH 342,Digital Representation,Architecture : This course introduces students to digital representation in architecture. Students explore applications of state-of-the-art two- and three-dimensional computer modeling software in architectural design.
ARCH 354,Architectural History 3,Architecture : The study of Modern European architecture from 1750 to 1950.
ARCH 355,Architectural History 4,Architecture : The study of cities and world architecture from 1900 to the present.
ARCH 375,Landscape,"Architecture : Land form, plant life, microclimate; land use and land preservation; elements and methods of landscape design."
ARCH 377,"Energy, Environment, and Buildings 1","Architecture : Exploration of the interrelationship between energy, environment, and building. Climate analysis and design, daylighting, electrical systems, plumbing and water conservation, and conveyance systems."
ARCH 378,Introduction to Building Environments,"Architecture : Introduction to ecology, technology, and building through climate change as a central topic for architects in this century."
ARCH 379,Summer Course Abroad,"Architecture : Studies in-situ of key buildings, landscapes and urban settings; techniques of graphic documentations, analysis of physical configuration, constructional details and present use. Excursions to neighbouring sites of architectural interest."
ARCH 383,Geometry and Architecture,"Architecture : Geometry in the formal structure of design. Grids, lattices, polygons and polyhedra; proportional systems. Evidence of these figures and structures in natural objects and phenomena. Graphical and physical models. Application to architecture and the human environment. Case studies."
ARCH 388,Introduction to Historic Preservation,Architecture : Historic attitudes and terminologies of conservation; historic research techniques. Restoration technology of building materials and principles of interior design in the 19th and 20th centuries; current preservation planning.
ARCH 405,Design and Construction 3,"Architecture : A structured investigation of architectural concepts; program interpretation with respect to relevant cultural, social and environmental contexts; applications of appropriate formal languages and building technologies in integrated proposals for a variety of building forms."
ARCH 406,Design and Construction 4,"Architecture : A detailed study and comprehensive development of architectural proposals for complex building types and site conditions; the exploration of coherent initial concepts with respect to programmatic requirements, image and form; subsequent elaboration leading to meaningful and technologically viable designs for the built environment."
ARCH 410,Design and Construction 5,"Architecture : A study of the function and structure of the urban environment, including surveys of selected urban areas by recording and analysing specific environmental factors. Architectural and urban design with reference to their social implications. Urban renewal and rehabilitation by means of systematic design methods. Techniques of visual communication including documentary film-making."
ARCH 445,Architectural Structures 2,Architecture : Holistic overview of structural systems for architects and application to real-world architectural projects. Fundamentals and principles of the philosophy of structures; structural theory; mechanics of structures; loadings; different structural components such as gravity and lateral force resisting systems; materials and other factors in the design and analysis of structures.
ARCH 447,"Energy, Environment, and Buildings 2","Architecture : Advanced exploration of the interrelationships among energy, environment, and building. Topics include energy efficiency, thermal envelopes, life-cycle design, materials selection, fluid mechanics of natural ventilation, thermal science
of passive design, adaptive thermal comfort, the 'air-conditioning trap', the 'embodied carbon blindspot,' and the 'timber-carbon sink'."
ARCH 451,Building Regulations and Safety,Architecture : The study of building codes with specific emphasis on the National Building and National Fire Codes of Canada. Examples of existing buildings with assignments to illustrate regulations. Development of a systematic approach to the implementation of codes during the preliminary design stage of an architectural project.
ARCH 461,Freehand Drawing and Sketching,"Architecture : Drawing and sketching in pencil, charcoal and other media both in the studio and out-of-doors."
ARCH 490,Selected Topics in Design,Architecture : A course to allow the introduction of special topics in related areas of design.
ARCH 500,Internship in Architecture,Architecture : A period of architecture internship consistent with the terms of reference of the Canadian Internship in Architecture Program (IAP).
ARCH 512,Architectural Modelling,Architecture : Architectural modelling using advanced applications in digital media. Topics include: 3-D modelling and rendering; image editing; digital animation; hypertext and the World Wide Web; issues of representation and methodology; comparison of publishing applications. Projects complement design studio courses and independent studies that are student or instructor initiated.
ARCH 515,Sustainable Design,"Architecture : This course will address sustainable design theory and applications in the built environment with students from a variety of fields (architecture, urban planning, engineering, sociology, environmental studies, economics, international studies). Architecture will provide the focus for environmental, socio-cultural and economic issues."
ARCH 517,Sustainable Residential Development,"Architecture : Design strategies of sustainable residential environments at the community and the unit levels. Historic references, siting principles, high density, healthy developments, green homes, urban renewal, circulation and parking, open spaces and implementation approaches."
ARCH 519,Field Course Abroad,"Architecture : Advanced and comprehensive studies in-situ of key buildings, landscapes and urban settings; techniques of graphic documentations, analysis of physical configuration, constructional details and present use."
ARCH 520,Montreal: Urban Morphology,"Architecture : Historical, geographical, demographical, and regional evolution of the metropolis of Montreal. Topics include: important quartiers, the Montreal urban grid, industrialization, reform movements, geographical diversity, urban culture, local building techniques and materials. Basic concepts of urban morphology and their relationships to the contemporary urban context will be explored."
ARCH 521,Structure of Cities,"Architecture : Nature, pattern and life of modern cities. Urban networks, special areas, problems and prospects."
ARCH 523,Significant Texts and Buildings,"Architecture : Critical study of significant architectural thought since 1750 as it has been expressed in buildings and texts (treatises, manifestos, criticisms). A specific theme will be addressed every year to allow in-depth interpretations of the material presented and discussed."
ARCH 525,Seminar on Analysis and Theory,Architecture : Analysis and evaluation of significant architectural projects with reference to contemporary architectural theories.
ARCH 526,Philosophy of Structure,"Architecture : Philosophy of Structure aims to investigate structure in its broadest sense. The course is divided in two halves; the first one gives an overview of the development of theoretical structural frameworks such as mathematics and geometry, while the second one highlights physical structures constructed by nature (geology, turbulence), man or animals."
ARCH 527,Civic Design,Architecture : The elements of form in buildings and their siting design in the urban setting.
ARCH 528,History of Housing,"Architecture : Indigenous housing both transient and permanent, from the standpoint of individual structure and pattern of settlements. The principal historic examples of houses including housing in the age of industrial revolution and contemporary housing."
ARCH 529,Housing Theory,Architecture : A review of environmental alternatives in housing; contemporary housing and the physical and sociological determinants that shape it; Canadian housing.
ARCH 531,Architectural Intentions Vitruvius - Renaissance,Architecture : Architectural intentions embodied in buildings and writings of architects from antiquity to the Renaissance. Special emphasis is placed on the cultural connections of architecture to science and philosophy.
ARCH 532,Origins of Modern Architecture,"Architecture : Examination of architectural intentions (theory and practice) in the European context (especially France, Italy and England), during the crucial period that marks the beginning of the modern era."
ARCH 533,New Approaches to Architectural History,"Architecture : An exploration of the aims, tools, and methods of architectural history as a discipline."
ARCH 535,History of Architecture in Canada,"Architecture : French, British and American influences in the history of Canadian architecture, with particular emphasis on the Eastern Provinces. Site visits and case studies."
ARCH 536,Heritage Conservation,Architecture : Historic attitudes and terminologies of conservation; historic research techniques. Restoration technology of building materials and principles of interior design in the 19th and 20th century; current preservation planning.
ARCH 540,Selected Topics in Architecture 1,"Architecture : A course to allow the introduction of new topics in Architecture as needs arise, by regular and visiting staff."
ARCH 541,Selected Topics in Architecture 2,"Architecture : A course to allow the introduction of new topics in Architecture as needs arise, by regular and visiting staff."
ARCH 551,Urban Design and Planning,"Architecture : Fundamentals of city-building in Canada relative to municipal, regional, and provincial actions used to guide urban growth and development. Contemporary urban design in major metropolitan centres as shaped by legal, political, and cultural realities. Current preoccupations in citybuilding: reurbanisation and adaptive reuse of infrastructure, collaborative multi-stakeholder projects, strategic initiatives, changing relationships between professional experts and grassroots actors. Introduction to specific aspects of practice: public participation and community engagement; land development and real estate; project feasibility and implementation; policy monitoring and evaluation; emergent city-building regimes."
ARCH 562,Innovative Homes and Communities,Architecture : Innovative design concepts for sustainable homes and communities to include adaptability; net-zero energy; micro units; recycling; plug and play; green roofs; aging in place and live-work.
ARCH 564,Design for Development,"Architecture : Designing for sustainable development to meet broad developmental goals. Innovative design approaches, strategies and projects to address these objectives via economic empowerment, food security, gender equity, health, sanitation,
climate-change preparedness, and shelter-sector engagements."
ARCH 566,Cultural Landscapes Seminar,"Architecture : Overview of cultural landscapes studies, methodologies, and resources. Comparative studies of the connection between people, place, and artifact systems through a critical examination of architecture, regional context, and material culture. Examination of precedents for the interpretation of cultural landscapes by architects, ethnologists, anthropologists, folklorists, historians, writers, filmmakers, photographers, and artists."
ARCH 491,Selected Topics in Landscape Studies,"Architecture : Current issues of landscape, environment, and climate with impacts on the theory and practice of architecture."
ARCH 492,Selected Topics in Professional Practice,Architecture : Critical aspects of the architect's contemporary role in professional practice.
ARCH 514,Community Design Workshop,"Architecture : Context-focused community-based architectural projects undertaken in collaboration with external partners. Exploration of challenges, needs, and opportunities in architectural and urban-design interventions on real sites through interdisciplinary and cross-sectorial collaboration."
ARCH 542,Selected Topics in Architecture 3,Architecture : Special topics related to architecture will be presented by core faculty and visiting lecturers.
ARCH 543,Selected Topics in Architecture 4,Architecture : Special topics related to architecture will be presented by core faculty and visiting lecturers.
BIEN 300,Thermodynamics in Bioengineering,"BIEN : Fundamental concepts of Thermodynamics: Internal Energy, Work, The three Laws of Thermodynamics, Enthalpy, and Entropy. Basic concepts of energy in living organisms: distribution of energy, energy conservation in living organisms, isothermal systems, Gibbs free energy in chemical coupling, reversible processes and redox reactions. Application of Thermodynamics in defining biological processes and components such as hydrolysis, osmosis, ELISA, PCR, DNA, amino acids, proteins."
BIEN 310,Introduction to Biomolecular Engineering,"BIEN : Forward and reverse engineering of biomolecular systems. Principles of biomolecular thermodynamics and kinetics. Structure and function of the main classes of biomolecules including proteins, nucleic acids, and lipids. Biomolecular systems as mechanical, chemical, and electrical systems. Rational design and evolutionary methods for engineering functional proteins, nucleic acids, and gene circuits. Rational design topics include molecular modeling, positive and negative design paradigms, simulation and optimization of equilibrium and kinetic properties, design of catalysts, sensors, motors, and circuits. Evolutionary design topics include evolutionary mechanisms, fitness landscapes, directed evolution of proteins, metabolic pathways, and gene circuits. Systems biology and synthetic biology."
BIEN 314,Transport Phenomena in Biological Systems 1,"BIEN : Basic concepts in transport phenomena, including fluid dynamics (momentum transport) and heat transfer (energy transport), with applications to biological
systems, both medical and non-medical. Topics in fluid dynamics include: properties of Newtonian and non-Newtonian fluids; dimensional analysis; drag;
integral/macroscopic balances (Bernoulli's equation and linear momentum theorem); differential/microscopic balances (continuity and Navier-Stokes equations); boundary layer approximations; turbulence. Topics in heat transfer include elements of conduction and convection."
BIEN 320,"Molecular, Cellular and Tissue Biomechanics","BIEN : Basic mechanics of biological building blocks, focusing on the cytoskeleton, with examples from pathology. At the macromolecular level: weak/variable crosslinking and hydrolysis driven athermal processes. At the cellular/tissue level: cell architecture and function. Discussion of modern analytical techniques capable of single-molecule to tissue scale measurements."
BIEN 330,Tissue Engineering and Regenerative Medicine,"BIEN : The history, scope, challenges, ethical considerations, and potential of tissue engineering. In vitro control of tissue development, differentiation, and growth, including relevant elements of immunology compared to in vivo tissue and organ development. Emphasis on the materials, chemical factors, and mechanical cues used in tissue engineering."
BIEN 340,Transport Phenomena in Biological Systems 2,BIEN : Fundamental principles of mass transport and its application to a variety of biological systems. Membrane permeability and diffusive transport. Convection. Transport across cell membranes. Ion channels. Blood rheology. Active transport. Intra- and inter-cellular transport.
BIEN 350,"Biosignals, Systems and Control","BIEN : Discrete- and continuous-time signals; basic system properties. Linear time-invariant systems; convolution. Frequency domain analysis; filtering; sampling. Laplace and Fourier transforms; transfer functions; poles and zeros; transient and steady state response. Z-transforms. Dynamic behaviour and PID control of first- and second-order processes. Stability. Applications to biological systems, such as central nervous, cognitive, and motor systems."
BIEN 360,Physical Chemistry in Bioengineering,"BIEN : Description of chemical systems with the help of theories of physics and application of its techniques: reaction kinetics, physical and chemical equilibria in biological systems. Review of energy transfer and thermodynamics. Chemical and physical equilibria in biology: variation of Gibbs energy with temperature, energy, composition. Theories of reaction kinetics and the reaction mechanism in biological phenomena: polymerization, protein folding, enzymes."
BIEN 390,Bioengineering Laboratory,"BIEN : Introduction to the fundamental principles of experimental design, statistical analysis, and scientific communications applied to bioengineering research.Laboratory topics include: DNA engineering and cloning, in vitro motility assays, mammalian cell culture and immunofluorescence, and microfabrication."
BIEN 410,Computational Methods in Biomolecular Engineering,"BIEN : Introduction to computational biomolecular engineering. Biomolecular simulation: deterministic simulation, stochastic simulation. Biomolecular modeling: energy minimization, coarse-grained methods. Computational biomolecular design: protein design, protein docking, and drug design. Computational systems and synthetic biology: computer simulation of biomolecular circuits."
BIEN 420,Biodevices Design for Diagnostics and Screening,"BIEN : Design of analytical devices for high throughput screening (HTS) for genomics, proteomics and other “omics” applications; and for diagnostics for medical, veterinary, or environmental applications. Assessment of the specific requirements of each 'client' applications, followed by a review of specific regulations and guidelines. Theoretical and practical guidelines regarding the design of a specific micro- or nano-device, and comparison with the established state of the art in the chosen application."
BIEN 462,Engineering Principles in Physiological Systems,"BIEN : Basic aspects of human physiology. Applications of general balance equations and control theory to systems physiology. The course will cover: circulatory physiology, nervous system physiology, renal physiology and the musculoskeletal system."
BIEN 470,Bioengineering Design Project,"BIEN : A capstone group design project on an industrially relevant engineering problem of a biological nature. Student teams work in consultation with faculty and industrial consultants in the design of functional and practical systems, devices, or processes, taking into account safety, sustainability, management and economic considerations."
BIEN 470D1,Bioengineering Design Project,"BIEN : A capstone group design project on an industrially relevant engineering problem of a biological nature. Student teams work in consultation with faculty and industrial consultants in the design of functional and practical systems, devices, or processes, taking into account safety, sustainability, management and economic considerations."
BIEN 470D2,Bioengineering Design Project,"BIEN : A capstone group design project on an industrially relevant engineering problem of a biological nature. Student teams work in consultation with faculty and industrial consultants in the design of functional and practical systems, devices, or processes, taking into account safety, sustainability, management and economic considerations."
BIEN 470N1,Bioengineering Design Project,"BIEN : A capstone group design project on an industrially relevant engineering problem of a biological nature. Student teams work in consultation with faculty and industrial consultants in the design of functional and practical systems, devices, or processes, taking into account safety, sustainability, management and economic considerations."
BIEN 470N2,Bioengineering Design Project,"BIEN : A capstone group design project on an industrially relevant engineering problem of a biological nature. Student teams work in consultation with faculty and industrial consultants in the design of functional and practical systems, devices, or processes, taking into account safety, sustainability, management and economic considerations."
BIEN 471,Bioengineering Research Project,"BIEN : Individual guided research projects in bioengineering. Under the guidance of a research adviser, students will propose and implement a research plan that addresses a current gap in knowledge or industry need. Projects will be designed to provide experience in critical evaluation of primary research literature, experimental approaches and methodologies, quantitative analysis, mathematical modelling, and effective written and oral presentation of scientific ideas."
BIEN 510,Engineered Nanomaterials for Biomedical Applications,"BIEN : Introduction to the interdisciplinary field of biomedical uses of nanotechnology. Emphasis on emerging nanotechnologies and biomedical applications including nanomaterials, nanoengineering, nanotechnology-based drug delivery systems, nano-based imaging and diagnostic systems, nanotoxicology and immunology, and translating nanomedicine into clinical investigation."
BIEN 520,High Throughput Bioanalytical Devices,"BIEN : Introduction to the field of high throughput screening (HTS) analytical techniques and devices used for genomics, proteomics and other ""omics"" approaches, as well as for diagnostics, or for more special cases, e.g., screening for biomaterials. Introduction into the motivation of HTS and its fundamental physico-chemical challenges; techniques used to design, fabricate and operate HTS devices, such as microarrays and new generation DNA screening based on nanotechnology. Specific applications: DNA, protein and diagnostic and cell and tissue arrays."
BIEN 530,Imaging and Bioanalytical Instrumentation,"BIEN : Microscopy techniques with application to biology and medicine. Practical introduction to optics and microscopy from the standpoint of biomedical research. Discussion of recent literature; hands-on experience. Topics include: optics, contrast techniques, advanced microscopy, and image analysis."
BIEN 540,Information Storage and Processing in Biological Systems,"BIEN : Storage and processing of information in biological systems, both natural and artificially-created, ranging from biomolecules, cells, and populations of cells.
Information storage in DNA and DNA computation; molecular surfaces of proteins; computation with motile biological agents in networks; and biological and biologically-inspired algorithms."
