Course Number,Course Name,Course Description
ECSE 474,Design Project 1,"Electrical Engineering : A laboratory design project undertaken with close supervision by a staff member. The project consists of defining an engineering problem, reviewing relevant background and literature, and seeking the solution through numerical simulation and/or experimental investigation. A literature review, written project proposal, and seminar presentation are required."
ECSE 475,Design Project 2,"Electrical Engineering : A laboratory design project undertaken with close supervision by a staff member. A continuation of ECSE 474 Design Project 1. The work consists of carrying out the project plan developed in ECSE 474 Design Project 1 producing a report summarizing the results, and a seminar presentation."
ECSE 476,Software Engineering Design Project 1,Electrical Engineering : Design project in software engineering.
ECSE 477,Software Engineering Design Project 2,Electrical Engineering : Design project in software engineering.
ECSE 478D1,Electrical Engineering Honours Thesis,"Electrical Engineering : A research project undertaken with close mentorship by a staff member and under the supervision of the course instructor. The thesis consists of defining an engineering problem, reviewing relevant background, acquiring/analyzing data, and seeking design solutions using appropriate simulation/analysis tools and experimental investigations."
ECSE 478D2,Electrical Engineering Honours Thesis,Electrical Engineering : See ECSE 478D1 for description.
ECSE 478N1,Electrical Engineering Honours Thesis,"Electrical Engineering : A research project undertaken with close mentorship by a staff member and under the supervision of the course instructor. The thesis consists of defining an engineering problem, reviewing relevant background, acquiring/analyzing data, and seeking design solutions using appropriate simulation/analysis tools and experimental investigations."
ECSE 478N2,Electrical Engineering Honours Thesis,Electrical Engineering : For decription see ECSE 478N1
ECSE 485,IC Fabrication Laboratory,"Electrical Engineering : Essential processes for silicon semiconductor device fabrication: etching, diffusion, photolithography. Fabrication of large area PN junctions, selective area PN junctions and MOSFETs. Design and fabrication of simple MOS circuits. Electrical characterization of devices and circuits."
ECSE 486,Power Laboratory,"Electrical Engineering : Techniques of electric power, efficiency, torque, speed measurements. Starting, running and control of electric machines: dc, synchronous, induction types. Power electronic controllers. Each group of students has access to a compact experiment bench containing a set of micro-machines and all the necessary equipment."
ECSE 487,Computer Architecture Laboratory,"Electrical Engineering : Basic software tools used in the design, synthesis and analysis of computer and communication systems such as data-paths, switching circuits, and arithmetic and logic circuits. Behavioral and structural modeling of hardware designs in the IEEE standard hardware description language VHDL. Synthesis and implementation of hardware designs using Programmable Logic Devices."
ECSE 488,High Frequency Laboratory,"Electrical Engineering : High frequency measurement techniques. Vector network analyzer and spectrum analyzer. Resistors, capacitors and inductors at high frequencies. High-level signal handling of a high-frequency bandpass amplifier. Electromagnetic interference (EMI) and spectrum coordination. Cavity resonators. Standing waves in waveguides. Reciprocity of microwave networks. Scattering parameters of a microstrip network."
ECSE 489,Telecommunication Network Laboratory,"Electrical Engineering : Practical insight into IP networking through hands on experience with network simulation software as well as common Internet monitoring and measurement tools. The experiments address MAC protocols, routing protocols, TCP, queuing disciplines and quality-of-service, network security and multimedia applications."
ECSE 490,Digital Signal Processing Laboratory,"Electrical Engineering : Experiments involving the digital processing of signals using computer-aided design tools for design, processing and visualization and real-time processing using DSP chips. Filter structures and design, multi-rate signal processing, filter banks, fast transforms, adaptive filtering, signal coding and quantization."
ECSE 491,Communication Systems Laboratory,"Electrical Engineering : Experimental studies and simulation of analog and digital transmission techniques. Performance of AM and FM systems. FSK and PSK modulation techniques and spectra. Sampling of analog signals, PCM and TDM techniques."
ECSE 492,Optical Communications Laboratory,"Electrical Engineering : Hands-on experience of the physical layer of optical communications systems. Experiments involving optical fiber link characterization, laser measurements, beam divergence, coupling efficiency. Use of lasers, optical spectrum analyser, data generator, beam profiler, photodetectors, optical filters. Experiments are supported with simulation and analysis software."
ECSE 493,Control and Robotics Laboratory,"Electrical Engineering : Experimental studies for the design of control systems, with particular emphasis on motion control as applicable to robotics. Modeling of DC motors and electro-mechanical systems. Controller design in the time and frequency domain as well as state space. Experimental examples of PID, lead-lag, full state feedback and LQR controllers."
ECSE 494,Electrical Engineering Design Project,Electrical Engineering : A laboratory design project undertaken with close supervision by a staff member. The project consists of defining an engineering problem and seeking the solution through experimental investigation. Results are reported in a seminar at the end of term and in a technical paper.
ECSE 496,Honours Research Laboratory Rotation 3,Electrical Engineering : Third in a series of four research laboratory rotations selected among research groups in the Department of Electrical and Computer Engineering.
ECSE 497,Honours Research Laboratory Rotation 4,Electrical Engineering : Fourth in a series of four research laboratory rotations selected among research groups in the Department of Electrical and Computer Engineering.
ECSE 498,Honours Thesis 1,"Electrical Engineering : A research project undertaken with close mentorship by a staff member and under the supervision of the course instructor. The thesis consists of defining an engineering problem, reviewing relevant background, acquiring/analyzing data, and seeking design solutions using appropriate simulation/analysis tools and experimental investigations."
ECSE 499,Honours Thesis 2,Electrical Engineering : A research project undertaken with close supervision by a staff member. A continuation of ECSE 498. The work consists of carrying out the research plan developed in ECSE 498 along with a seminar presentation at end of term.
ECSE 500,Mathematical Foundations of Systems,"Electrical Engineering : Basic set theories and algebraic structures, linear spaces, linear mappings, topological and metric spaces, separable spaces, continuity, compactness, Lebesque measure on Euclidean spaces, measurability, Banach spaces, Hilbert spaces, linear bounded operators in Banach spaces, dual spaces, adjoint operators, the Orthogonal Projection Theorem, properties of the Fourier series, convergence in probability."
ECSE 501,Linear Systems,"Electrical Engineering : Mathematical models of linear systems, fundamental solution and transition matrices, non-homogeneous linear equations, controllability and observability of linear systems, reachable subspaces, Cayley-Hamilton's Theorem, Kalman's controllability and observability rank conditions, minimal realizations, frequency response, invariant subspaces, finite and infinite horizon linear regulator problems, uniform, exponential, and input-output stability, the Lyapunov equation."
ECSE 504,Sampled Data Control,"Electrical Engineering : Sampling and aliasing. Conversion of continuous-time controllers using s-to-z transformations; pre-and post-filtering. Discrete time state representation and z-transfer function of sampled linear, time-invariant systems. Correspondence between system theoretic results for continuous- and discrete-time systems. Sampled-data design, including pole placement, LQR control and model predictive control."
ECSE 507,Optimization and Optimal Control,"Electrical Engineering : General introduction to optimization methods including steepest descent, conjugate gradient, Newton algorithms. Generalized matrix inverses and the least squared error problem. Introduction to constrained optimality; convexity and duality; interior point methods. Introduction to dynamic optimization; existence theory, relaxed controls, the Pontryagin Maximum Principle. Sufficiency of the Maximum Principle."
ECSE 508,Multi-Agent Systems,"Electrical Engineering : Introduction to game theory, strategic games, extensive form games with perfect and imperfect information, repeated games and folk theorems, cooperative game theory, introduction to mechanism design, markets and market equilibrium, pricing and resource allocation, application in telecommunication networks, applications in communication networks, stochastic games."
ECSE 509,Probability and Random Signals 2,"Electrical Engineering : Multivariate Gaussian distributions; finite-dimensional mean-square estimation (multivariate case); principal components; introduction to random processes; weak stationarity: correlation functions, spectra, linear processing and estimation; Poisson processes and Markov chains: state processes, invariant distributions; stochastic simulation."
ECSE 510,Filtering and Prediction for Stochastic Systems,"Electrical Engineering : Electrical Engineering: Basic notions. Linear state space (SS) systems. Least squares estimation and prediction: conditional expectations; Orthogonal Projection Theorem. Kalman filtering; Riccati equation. ARMA systems. Stationary processes; Wold decomposition; spectral factorization; Wiener filtering. The Wiener processes; stochastic differential equations. Chapman-Kolmogorov, Fokker-Plank equations. Continuous time nonlinear filtering. Particle filters. Applications."
ECSE 511,Introduction to Digital Communication,"Electrical Engineering : Amplitude and angle modulation including AM, FM, FDM and television systems; introduction to random processes; sampling and quantization, PCM systems, TDM; digital modulation techniques, Maximum-Likelihood receivers, synchronization issues; elements of information theory including information sources, source coding and channel capacity."
ECSE 512,Digital Signal Processing 1,"Electrical Engineering : Review of discrete-time transforms, sampling and quantization, frequency analysis. Structures for IIR and FIR filters, coefficient quantization, roundoff noise. The DFT, its properties, frequency analysis and filtering using DFT methods, the FFT and its implementation. Multirate processing, subsampling and interpolation, oversampling techniques."
ECSE 513,Robust Control Systems,Electrical Engineering : Feedback interconnections of LTI systems; Nominal stability and performance of feedback control systems; Norms of signals and systems; H2-optimal control; H-infinity-optimal control; Uncertainty modelling for robust control; Robust closed-loop stability and performance; Robust H-infinity control; Robustness check using mu-analysis; Robust controller design via mu-synthesis.
ECSE 515,Optical Fibre Communications,"Electrical Engineering : Optical fibre communication technology and principles of optical transport: modulation formats, signal propagation and impairments in optical fibres, sources of noise, amplification and regeneration, optical signal processing technologies, system design."
ECSE 516,Nonlinear and Hybrid Control Systems,"Electrical Engineering : Examples of hybrid control systems (HCS). Review of nonlinear system state, controllability, observability, stability. HCS specified via ODEs and automata. Continuous and discrete states and dynamics; controlled and autonomous discrete state switching. HCS stability via Lyapunov theory and LaSalle Invariance Principle. Hybrid Maximum Principle and Hybrid Dynamic Programming; computational algorithms."
ECSE 517,Neural Prosthetic Systems,"Electrical Engineering : Selected topics in bioengineering focusing on the principles of neural prosthetics systems (brain machine interfaces). Paralysis as a communication problem. Motor control theory receptive fields. Electrical properties of the central nervous system, modern measurement technologies, encoding and mutual information, statistical data analysis, decoding and thought prediction."
ECSE 518,Telecommunication Network Analysis,Electrical Engineering : Mathematical modeling and analysis techniques for the control and management of modern networks. Introduction to queuing networks; birth/death processes; routing optimization and fairness; multi-commodity network flow; traffic modeling; effective bandwidth and network calculus; performance modeling.
ECSE 519,Semiconductor Nanostructures and Nanophotonic Devices,"Electrical Engineering : Physics, design, synthesis, and fundamental properties of semiconductor nanostructures, quantum dots, nanowires, and nanotubes. Nanoscale confinement of radiation, properties of microcavities, whispering gallery modes, photonic crystals, strong vs. weak coupling, and Purcell effect. Quantum dot lasers, nanowire LEDs, and photonic crystal lasers. Nonclassical light sources. Solar cells and thermoelectric devices."
ECSE 521,Digital Communications 1,"Electrical Engineering : Transmission over AWGN channels: optimum receiver design, digital modulation techniques, coherent, noncoherent and differentially coherent detection. Signal design for bandlimited AWGN channels. Channel capacity. Channel coding: block codes, convolutional codes, coded modulation techniques, turbo codes. Transmission over AWGN and ISI channels: MLSE, linear equalization, decision-feedback equalization, precoding, multi-carrier transmission."
ECSE 522,Nonlinear Phenomena in Power Systems Dynamics,"Electrical Engineering : Introduces nonlinear dynamics, with applications to generic engineering and power engineering. Topics include one- and two- dimensional systems; bifurcations;
phase plane; nonlinear oscillators; Lorenz equations and chaos. Emphasizes power system dynamic modelling and stability. Topics include synchronous machine
dynamic modelling; numerical integration methods for dynamic simulations; excitation system and turbine governor; transient stability; small signal stability; voltage stability; nonlinear dynamics and bifurcations in power system dynamic study."
ECSE 523,Speech Communications,"Electrical Engineering : Articulatory and acoustic descriptions of speech production, speech production models, speech perception, digital processing of speech signals, vocodors using formant, linear predictive and cepstral techniques, overview of automatic speech recognition systems, speech synthesis systems and speaker verification systems."
ECSE 524,Interconnects and Signal Integrity,"Electrical Engineering : Interconnect structures, signal integrity issues: reflection, crosstalk, noise, electromagnetic interference, Lossy transmission lines, RLGC matrix representations, wave propagation in multilayered substrates, periodically loaded lines, Floquet's theorem, power distribution network, simultaneous switching noise, packaging structures, chip interconnection technologies, substrate integrated waveguides, methods for experimental characterization of interconnects, signal integrity CAD tools."
ECSE 526,Artificial Intelligence,"Electrical Engineering : Design principles of autonomous agents, agent architectures, machine learning, neural networks, genetic algorithms, and multi-agent collaboration. The course includes a term project that consists of designing and implementing software agents that collaborate and compete in a simulated environment."
ECSE 527,Optical Engineering,"Electrical Engineering : A structured introduction to modern optical engineering. Topics covered include the
propagation of light through space, refraction, diffraction, polarization, lens systems, ray-tracing, aberrations, computer-aided design and optimization techniques, Gaussian beam analysis, micro-optics and computer generated
diffractive optical elements."
ECSE 528,Telecommunication Network Architecture,Electrical Engineering : Introduction to the architecture of telecommunication networks; OSI Layer Model and Internet protocol stack; Peer-to-peer and overlay networks; basic queuing theory; congestion control and reliable data transfer; addressing and routing for unicast and multicast transmission; traffic scheduling and shaping; quality-of-service principles; multiple access protocols; streaming media and network security.
ECSE 529,Computer and Biological Vision,"Electrical Engineering : Vision in man and machine, imaging process, spatial and frequency domain filters, biological vision, edge detection, intermediate features, connecting biological and psychophysical vision, science of colour."
ECSE 530,Logic Synthesis,"Electrical Engineering : The place of logic synthesis in microelectronics. Representations of Boolean functions: logic covers, binary decision diagrams. Two-level synthesis algorithms, Espresso. Multi-level synthesis to Boolean networks: don't care methods, algebraic optimizations, delay modelling. Sequential synthesis: state-based optimizations, state assignment, network optimizations. Technology mapping: library cell and FPGA mapping."
ECSE 532,Computer Graphics,"Electrical Engineering : Fundamental mathematical, algorithmic and representational issues in computer graphics: overview of graphics pipeline, homogeneous coordinates, projective transformations, line-drawing and rasterization, hidden surface removal, surface modelling (quadrics, bicubics, meshes), rendering (lighting, reflectance models,
ray tracing, texture mapping), compositing colour perception, and other selected topics."
ECSE 533,Physical Basis of Semiconductor Devices,"Electrical Engineering : Quantitative analysis of diodes and transistors. Semiconductor fundamentals, equilibrium and non-equilibrium carrier transport, and Fermi levels. PN junction diodes, the ideal diode, and diode switching. Bipolar Junction Transistors (BJT), physics of the ideal BJT, the Ebers-Moll model. Field effect transistors, metal-oxide semiconductor structures, static and dynamic behaviour, small-signal models."
ECSE 534,Analog Microelectronics,"Electrical Engineering : Design of analog ICs using specialized analog CAD tools such as SPICE. Voltage and current amplifier design which encompasses the study of biasing circuits, current sources and mirrors, input and output stages, and frequency compensation; precision reference sources; analog multipliers; oscillators; waveform generators and shaping circuits, and analog switches."
ECSE 535,Nanoelectronic Devices,"Electrical Engineering : Physical principles and modelling of nanoelectronic devices. Bandstructure and electronic density of states, Quantum wells, wires and dots. Ballistic electron transport, tunnelling and scattering mechanisms. Electrical and optical properties of nanostructures, fundamental performance limits. Research devices and materials."
ECSE 536,RF Microelectronics,"Electrical Engineering : Introduction to Radio Frequency Integrated Circuits and wireless transceiver architectures. Modelling of passive/active integrated devices. Design of monolithic bipolar and CMOS LNAs, mixers, filters, broadband amplifiers, RF power amplifiers, VCOs, and frequency synthesizers. Analysis of noise and non-linearity in RFICs. Project using modern RFIC simulation/layout CAD tools."
ECSE 537,Advanced Digital Integrated Circuits,"Electrical Engineering : Advanced concepts in the design, layout, and optimization (speed/power/area trade-offs) of digital integrated circuits in state-of-the-art technologies. Emphasis on the main design challenges (low power, process variations) due to device scaling into the nanometer node. Integrated-circuit design flow. Computer-aided design tools."
ECSE 538,Safety-Critical Embedded Software,Electrical Engineering : Software for embedded systems/cyber-physical systems; model-based design; platform-based design; models of computation; synchronous reactive models of computation; timed automata; semantics preserving code generation; real-time operating systems; mixed-criticality scheduling; formal verification; model-based testing; reliability; safety; component-based design.
ECSE 539,Advanced Software Language Engineering,"Electrical Engineering : Practical and theoretical knowledge for developing software languages and models; foundations for model-based software development; topics include principles of model-driven engineering; concern-driven development; intentional, structural, and behavioral models as well as configuration models; constraints; language engineering; domain-specific languages; metamodelling; model transformations; models of computation; model analyses; and modeling tools."
ECSE 540,Photonic Devices and Applications,"Electrical Engineering : Physical basis of passive and active photonic devices, including optical waveguides and fibers, semiconductor lasers, photodetectors, modulators, and amplifiers. Applications to optical signal processing and photonic systems. Introduction to optical test-and-measurement instrumentation."
ECSE 541,Design of Multiprocessor Systems-­on-­Chip,"Electrical Engineering : Modelling, design, evaluation, and optimization of multiprocessor systems-on-chips (MPSoCs). Introduction to system-level modelling of MPSoC architecture; system performance, power, and lifetime modelling; fault and defect tolerance; automatic general and heuristic design space exploration and design optimization; resource allocation, application mapping, and task scheduling."
ECSE 542,Human Computer Interaction,"Electrical Engineering : Design, development, and evaluation of human-computer interfaces, with emphasis on usability, interaction paradigms, computer-mediated human activities, and implications to society. These issues are studied from a number of perspectives including that of the engineer and end-user. A team-based project applies knowledge and skills to the full life cycle of an interactive human-computer interface."
ECSE 543,Numerical Methods in Electrical Engineering,Electrical Engineering : DC resistor networks and sparse matrix methods. Nonlinear electric and magnetic circuits: curve-fitting; the Newton-Raphson method. Finite elements for electrostatics. Transient analysis of circuits: systems of Ordinary differential equations; stiff equations. Transient analysis of induced currents. Solution of algebraic eigenvalue problems. Scattering of electromagnetic waves: the boundary element method; numerical integration.
ECSE 544,Computational Photography,"Electrical Engineering : An overview of techniques and theory underlying computational photography. Topics include: radiometry and photometry; lenses and image formation; electronic
image sensing; colour processing; lightfield cameras; image deblurring; super-resolution methods; image denoising; flash photography; image matting and
compositing; high dynamic range imaging and tone mapping; image retargeting; image stitching."
ECSE 545,Microelectronics Technology,"Electrical Engineering : Basic techniques in the fabrication of microelectronic circuits. Four-point probe, alloyed contacts, diffusion processes, ion implantation epitaxy, silicon dioxide, photolithography, selected diffusion and metallization, transistor fabrication, dry etching, monolithic integrated circuits, isolation, mask making, thin and thick film components, MOS gate voltage and integrated circuits."
ECSE 546,Advanced Image Synthesis,"Electrical Engineering : Introduction to mathematical models of light transport and the numerical techniques used to generate realistic images in computer graphics. Offline (i.e., raytracing) and interactive (i.e., shader-based) techniques. Group project addressing important applied research problems."
ECSE 547,Finite Elements in Electrical Engineering,"Electrical Engineering : Finite elements for electrostatics. Energy minimization. Semi-conductors. Nonlinear magnetics and Newton-Raphson. Axisymmetric problems. Capacitance, inductance, and resistance through finite elements. Resonance: cavities, waveguides. High order and curvilinear elements."
ECSE 548,Introduction to VLSI Systems,"Electrical Engineering : An interdisciplinary course for electrical engineering and computer science students. A structured design methodology for managing the complexity of VLSI system design. Sufficient information on integrated devices, circuits, digital subsystems and system architecture is presented to enable students to span the range of abstractions from device physics to VLSI digital systems."
ECSE 549,Expert Systems in Electrical Design,"Electrical Engineering : Design processes in electrical engineering. Hierarchical design. Computer aided design. Expert system technology. Device representations, heuristics and structures, algebraic models. Design versus diagnosis, ""Shallow"" and ""Deep"" systems, second generation (multi-paradigm) systems. Shells and their uses in design systems. Knowledge acquisition systems."
