Course Number,Course Name,Course Description
MECH 537,High-Speed Aerodynamics,"Mechanical Engineering : Equations of compressible flows. Planar and conical shock waves. Expansion and shock wave interference; shock tubes. Method of characteristics. Supersonic nozzle design. Aerofoil theory in high subsonic, supersonic and hypersonic flows. Conical flows. Yawed, delta and polygonal wings; rolling and pitching rotations. Wing-body systems. Elements of transonic flows."
MECH 538,Unsteady Aerodynamics,Mechanical Engineering : Fundamental equations of unsteady compressible flows in fixed or moving reference frames. Unsteady flows past bodies in translation and having oscillatory motions. Oscillations of cylindrical pipes or shells subjected to internal flows. Vortex theory of oscillating aerofoils in incompressible flows. Theodorsen's method. Unsteady compressible flow past oscillating aerofoils.
MECH 539,Computational Aerodynamics,"Mechanical Engineering : Fundamental equations. Basic flow singularities. Boundary element methods. Source, doublet and vortex panel methods for 2D and 3D incompressible and compressible flows. Method of characteristics. Euler equations for inviscid rotational flows. Finite-difference and finite-volume methods. Explicit and implicit time-integration methods. Quasi 1D solutions. Nozzle and confined aerofoil applications."
MECH 541,Kinematic Synthesis,"Mechanical Engineering : The role of kinematic synthesis within the design process. Degree of freedom. Kinematic pairs and bonds. Groups and subgroups of displacements. Applications to the qualitative synthesis of parallel-kinematics machines with three and four degrees of freedom. Function, motion and path generation problems in planar, spherical and spatial four-bar linkages. Extensions to six-bar linkages. Cam mechanisms."
MECH 542,Spacecraft Dynamics,"Mechanical Engineering : Review of central force motion; Hohmann and other coplanar transfers, rotation of the orbital plane, patched conic method. Orbital perturbations due to the earth's oblateness, solar-lunar attraction, solar radiation pressure and atmospheric drag. Attitude dynamics of a rigid spacecraft; attitude stabilization and control; attitude manoeuvers; large space structures."
MECH 543,Design with Composite Materials,"Mechanical Engineering : Material systems/selection process. Cost vs. performance. Laminate layup procedures. Theory and application of filament winding of composite cylinders. Regular oven and autoclave oven curing, analysis of resulting material performance. Practical design considerations and tooling. Analysis of environmental considerations. Joining techniques. Analysis of test methods. Theory of repair techniques."
MECH 544,Processing of Composite Materials,"Mechanical Engineering : Composite processing science basic principles. Reinforcement properties; permeability, compaction. Resin properties; curing, viscosity, shrinkage. Heat transfer and cure kinetics; cure cycle optimization. Resin flow; infusion, thickness variations, fiber volume fraction distribution. Residual stresses; tool-part interaction, warpage control, spring-back, tool design. Thermoplastic composites; crystallization control, melting and consolidation."
MECH 546,Finite Element Methods in Solid Mechanics,"Mechanical Engineering : Discrete systems; variational formulation and approximation for continuous systems; direct and variational methods of element formulation in 1- 2- and 3 dimensions; formulation of isoparametric finite elements; plate and shell elements; finite element method for static analysis, vibration analysis and structural dynamics; introduction to nonlinear problems."
MECH 547,Mechanics of Biological Materials,"Mechanical Engineering : Mechanics of proteins (collagen, keratin), polysaccharides (cellulose, chitin), cells, skin, bone, teeth, seashells, insect and arthropod cuticles. Emphasis on microstructure-property-function relationships and on multiscale approach. State-of-the-art experimental and modelling techniques. Self-healing and adaptive biological materials."
MECH 548,Cellular Materials in Natural and Engineering Structures,"Mechanical Engineering : Overview of hierarchical solids exhibiting cellular structure. Cell size, shape and topology of bending and stretching dominated materials, including periodic microtruss lattice, plant cellular tissue and trabecular bone. Theories for modelling the mechanics and the physical properties; design and optimization of multifunctional cellular solids for ultralight aerospace and biomedical applications."
MECH 550,Vibrations of Continuous Systems,"Mechanical Engineering : Introduction to continuous systems. Discretization methods. Vibrations of Euler-Bernoulli and Timoshenko beams. Boundary conditions, intermediate supports and penalty method. Strain-displacement relationships for plates/shells. Vibrations of plates and shells. Sloshing and added mass. Effect of geometric imperfections and thermal loads. Introduction to nonlinear dynamics and stability. Introduction to experimental techniques."
MECH 551,Nonlinear Dynamics of Shell Structures,Mechanical Engineering : Introduction to nonlinear dynamics and stability; softening and hardening systems; bifurcations; Lyapunov exponents; nonlinear strain-displacement relationships; Lagrangian description; plates and shells; nonlinear vibrations of plates and shells; reduced-order models; stability of shells with cardiovascular application; supersonic flutter of circular cylindrical shells (rockets).
MECH 553,Design and Manufacture of Microdevices,Mechanical Engineering : Introduction to microelectromechanical systems (MEMS). Micromachining techniques (thin-film deposition; lithography; etching; bonding). Microscale mechanical behaviour (deformation and fracture; residual stresses; adhesion; experimental techniques). Materials- and process-selection. Process integration. Design of microdevice components to meet specified performance and reliability targets using realistic manufacturing processes.
MECH 554,Microprocessors for Mechanical Systems,"Mechanical Engineering : Digital logic and circuits - asynchronous and synchronous design. Microcontroller architectures, organization and programming - assembly and high-level. Analog/ digital/hybrid sensors and actuators. Sensing and conditioning subsystems. Interfacing issues. Real-time issues. Operator interfaces. Laboratory exercises on digital logic design, interfacing and control of peripherals with a final team project."
MECH 556,Microfluidics and BioMEMS,"Mechanical Engineering : Fundamentals of micro-electro-mechanical systems (MEMS) and microfluidic devices (also called lab-on-a-chip devices), and their applications to biology and medicine. Topics include: microfabrication techniques, MEMS sensing and actuation principles, microfluidics theories, microfluidic device design, packaging and characterization of MEMS and microfluidic devices, bioanalytical techniques in microfluidics. Students will have the opportunity to conduct two term designs in microfluidics and bioMEMS."
MECH 557,Mechatronic Design,"Mechanical Engineering : Team project course on the design, modelling, model validation, and control of complete mechatronic systems, constructed with modern sensors, actuators, real-time operating systems, embedded controllers, and intelligent control."
MECH 559,Engineering Systems Optimization,"Mechanical Engineering : Introduction to systems-oriented engineering design optimization. Emphasis on i) understanding and representing engineering systems and their structure, ii) obtaining, developing, and managing adequate computational (physics- and data-based) models for their analysis, iii) constructing appropriate design models for their synthesis, and iv) applying suitable algorithms for their numerical optimization while accounting for systems integration issues. Advanced topics such as coordination of distributed problems and non-deterministic design optimization methods."
MECH 560,Eco-design and Product Life Cycle Assessment,"Mechanical Engineering : Fundamentals of both product and process engineering with an emphasis on life cycle models and sustainability. Practical and theoretical topics, methodologies,
principles, and techniques. Practical methods such as Life Cycle Analysis, eco-design strategies, streamlined Life Cycle Assessment, environmental impact
assessment, and Life Cycle Engineering. Introduction to important product development theories and life cycle assessment theories."
MECH 561,Biomechanics of Musculoskeletal Systems,"Mechanical Engineering : The musculoskeletal system; general characteristics and classification of tissues and joints. Biomechanics and clinical problems in orthopaedics. Modelling and force analysis of musculoskeletal systems. Passive and active kinematics. Load-deformation properties of passive connective tissue, passive and stimulated muscle response. Experimental approaches, case studies."
MECH 562,Advanced Fluid Mechanics,"Mechanical Engineering : Conservation laws, control volume analysis, Navier stokes equations, dimensional analysis and limiting forms of N-S equation, laminar viscous flows, boundary layer theory, inviscid potential flows, lift and drag, introduction to turbulence."
MECH 563,Biofluids and Cardiovascular Mechanics,"Mechanical Engineering : Basic principles of circulation including vascular fluid and solid mechanics, modelling techniques, clinical and experimental methods and the design of cardiovascular devices."
MECH 565,Fluid Flow and Heat Transfer Equipment,"Mechanical Engineering : Pipes and piping systems, pumps, and valves. Fans and building air distribution systems. Basic thermal design methods for fins and heat exchangers. Thermal design of shell-and-tube and compact heat exchangers."
MECH 566,Fluid-Structure Interactions,"Mechanical Engineering : Pipes and cylindrical shells containing flow: fundamentals and applications in ocean mining, Coriolis mass-flow meters, heat exchangers, nuclear reactors and aircraft engines; chaos. Cylinders in axial flow and in cross-flow; vortex-shedding and galloping. Cylinder arrays in cross-flow; fluidelastic instabilities. Ovalling of chimneys."
MECH 567,Structural Dynamics of Turbomachines,"Mechanical Engineering : Fundamentals of turbomachines from the standpoint of structural dynamics and vibration analysis, with preference given to aerospace applications involving
aircraft and helicopter engines. Topics include: introduction to the finite element method, aircraft/helicopter engines architecture and main components, general equations of motion in rotordynamics, advanced modal analysis, Campbell diagrams and critical rotational velocity, mistuning and cyclic symmetry, fluid-structure coupling, flutter analysis, high-cycle fatigue."
MECH 572,Mechanics and Control of Robotic Manipulators,"Mechanical Engineering : Historical development and applications of robotic manipulators. Homogeneous
transformations and geometry. Forward and inverse kinematics, manipulator Jacobian.
Newton-Euler and Lagrangian formulations of inverse and forward dynamics. Trajectory
planning for pick-and-place operations. Linear independent joint control and nonlinear model-based control schemes."
MECH 573,Mechanics of Robotic Systems,Mechanical Engineering : Manipulator performance and design. Pick-and-place and continuous-path operations. Computation of rigid-body angular velocity and acceleration from point-data measurements. Inverse kinematics of serial manipulators with coupled architectures; kinetostatics of multifingered hands and walking machines. Kinematics and dynamics of parallel manipulators and wheeled mobile robots.
MECH 577,Optimum Design,Mechanical Engineering : The role of optimization within the design process: Design methodology and philosophy. Constrained optimization: The Kuhn-Tucker conditions. Techniques of linear and non-linear programming. The simplex and the complex methods. Sensitivity of the design to manufacturing errors. Robustness of the design to manufacturing and operation errors.
MECH 578,Advanced Thermodynamics,"Mechanical Engineering : Review of classical mechanics; Boltzmann statistics, thermodynamics of ideal gases; Fermi-Dirac and Bose-Einstein statistics, Gibbsian ensembles; elementary kinetic theory of transport processes, Boltzmann equation, Boltzmann H-theorem and entropy, KBG approximation, discussion on the solution of Boltzmann equation; Maxwell transport equations, derivation of Navier Stokes equations."
MECH 579,Multidisciplinary Design Optimization,"Mechanical Engineering : A comprehensive introduction to important algorithms in sensitivity analysis and multidisciplinary design optimization of large systems. Topics include: unconstrained and constrained optimization, sensitivity analysis, gradient-free optimization, multi-objective optimization, and various multidisciplinary algorithms and approaches for design optimization."
MECH 531,Aeroelasticity,"Mechanical Engineering : Wing divergence using strip-theory aerodynamics. Effect of aircraft flexibility on the control and stability. Flutter calculations for two-dimensional wings with discussion of three-dimensional effects. Some examples of aeroelastic instability, and the relevant analysis of non-aeronautical problems."
MECH 360,Principles of Manufacturing,"Mechanical Engineering : Theory and practice of modern manufacturing processes: machining, forming, and casting. Producing parts using computer assisted tools from CAD to CNC machining followed by measurement of part quality. Hands-on machining of parts."
MIME 308,Social Impact of Technology,"Mining & Materials Engineering : Critical examination of the socio-economic costs and benefits of technology, case studies of old engineering works and new technologies. The integration of applied ethics and engineering practice, analysis of basic concepts of technology assessment, the inter-connected processes of risk assessment, management, and communication."
MIME 311,Modelling and Automatic Control,"Mining & Materials Engineering : Mass and energy conservation laws. Dynamic versus steady state models, dynamic behaviour of first and higher order metallurgical systems, linear and nonlinear models, interacting and noninteracting systems. Laplace domain dynamics and transfer functions. Feedback control, control valves and controllers, transducers. Feedback-feedforward control, introduction to cascade, adaptive and statistical control strategies. Digital computer control, instruments and interfaces."
MIME 317,Analytical and Characterization Techniques,"Mining & Materials Engineering : Bulk, surface and microanalytical techniques for materials characterization. Bulk analysis: spectrophotometry using UV, visible, flame and atomic absorption, x-ray diffraction and x-ray fluorescence. Surface and microanalysis: infrared spectroscopy, scanning and transmission electron microscopy, Auger electron and x-ray photoelectron spectroscopy."
MIME 320,Extraction of Energy Resources,"Mining & Materials Engineering : The extraction of energy resources, i.e. coal, gas, oil and tar sands. After a brief geological review, different extraction techniques for these substances will be discussed. Emphasis on problems such as northern mining and offshore oil extraction with reference to Canadian operations. Transportation and marketing."
MIME 322,Rock Fragmentation,"Mining & Materials Engineering : Principles of drilling, penetration rates, performance and factors to consider in the choice of a drilling method. Characteristics of explosives, firing systems and blast patterns. Blasting techniques in surface and underground workings and in permafrost. Special blasting techniques at excavation perimeters. Vibration and noise control. Economics of drill/blast practice, interface with transport and crushing systems. Legislation and safety in explosives use and handling. Ripping and fullface boring machines."
MIME 323,Rock and Soil Mass Characterization,"Mining & Materials Engineering : Characteristics of soil and rock masses and the stability of mine workings. Mechanical properties of rocks and soils related to physical/chemical properties. Characterization of rock mass discontinuities. Laboratory and in-situ techniques to define mechanical properties of soils, rocks and discontinuities. Permeability and groundwater flow principles. In-situ stresses and their measurement. Rock mass quality and classification systems."
MIME 325,Mineral Industry Economics,"Mining & Materials Engineering : Geographical distribution of mineral resources. Production, consumption and prices of minerals. Market structure of selected minerals. Economic evaluation aspects: grade-tonnage considerations; capital and operating cost estimation; assessment of market conditions; estimation of revenue; taxation; sensitivity and risk analyses; economic optimization of mine development and extraction."
MIME 329,Mining Geology,"Mining & Materials Engineering : Methods of field mapping (e.g., geology, structure), drilling and sampling; concept of cut-off grade; resource estimation by conventional and geostatistical methods."
MIME 330,Mining Geotechnics,Mining & Materials Engineering : Properties of soils; permeability and seepage; effective stress concept; compressibility and settlement; lateral earth pressure; soil compaction; stability and design of embankments and mine tailings dams; problems related to mine tailings: liquefaction and disposal; gravitational flow of soils; buried structures.
MIME 333,Materials Handling,"Mining & Materials Engineering : Physical and mechanical characteristics of materials related to loading, transport and storage. Dynamics of particles, systems and rigid bodies, mass-acceleration, work-energy, impulse-momentum. Types and selection of excavation and haulage equipment. Layout of haul roads. Rail transport. Conveyor belts and chain conveyors. Mine hoists. Layout of mine shafts."
MIME 340,Applied Fluid Dynamics,"Mining & Materials Engineering : Flow analysis and manometry. Conservation of mass and momentum. Flow in pipes and ducts, analysis of pipe networks. First and second law of thermodynamics and their applications. Open channel flows. Dimensional analysis and similitude. Flow measurements. Settling and separation of particles. Non-Newtonian flow and slurry transport. Fluidized beds. Filtration of liquid/solid mixtures. Conduction heat transfer. Convection heat transfer. Principle of heat
exchanger."
MIME 341,Introduction to Mineral Processing,"Mining & Materials Engineering : Theory and practice of unit operations including: size reduction-crushing and grinding; size separation-screening and classification; mineral separation-flotation, magnetic and gravity separation. Equipment and circuit design and selection. Mass balancing. Laboratory procedures: grindability, liberation, magnetic and gravity separation, flotation and solid-liquid separation."
MIME 350,Extractive Metallurgical Engineering,"Mining & Materials Engineering : Principle non-ferrous base-metal pyrometallurgical extraction processes, relevant thermodynamics, heat and mass balances, transport phenomena (copper, nickel, lead, zinc, aluminum, magnesium). Ores, gangue, fuels, slag, fluxes, recovery, refining, minor elements, byproducts and the environment. Roasting, drying, smelting, converting, reverberatory furnaces, flash furnaces, continuous and batch operations, injection practices and oxygen enrichment. Simulation, modelling, control and optimization."
MIME 352,Hydrochemical Processing,"Mining & Materials Engineering : Analysis and description of dissolution (leaching), solute separation (solvent extraction, ion exchange, carbon adsorption) and deposition operations (precipitation, crystallization, electrolysis) in aqueous reaction media as these apply to: (i) the hydrometallurgical extraction of metals from primary/secondary sources; (ii) the treatment of effluents and (iii) the production of inorganic materials."
MIME 356,"Heat, Mass and Fluid Flow","Mining & Materials Engineering : Fluid statics and dynamics. Newton's laws of viscosity and motion, control volume analyses. Navier Stokes, Euler. Bemoulli and Steady Flow Energy Equations. turbulence and Reynolds stress equations. Molecular conduction/diffusion processes in heat and mass transfer). Convective flows. Transport coefficients in slags, metals and gases. Radiative heat transfer.  Transient/steady state flow."
MIME 360,Phase Transformations: Solids,"Mining & Materials Engineering : Free energy (equilibrium) and kinetic (non-equilibrium) considerations, phase diagrams and TTT diagrams, solid state diffusion, diffusional (nucleation and growth) and shear (martensitic) transformations."
MIME 362,Mechanical Properties,"Mining & Materials Engineering : Stress-strain behaviour. Elasticity and plasticity of metals, ceramics and polymers. Dislocations theory. Single crystal and polycrystalline slip. Mechanical twinning. Strengthening mechanisms. Process-property and microstructure-property relationships. Notch toughness and fracture mechanics. Failure, fracture and damage accumulation. Fatigue. Creep and creep rupture. Fractography. Design considerations in materials selection."
MIME 380,Industrial Training 2,Mining & Materials Engineering : One four-month work period in industry. Work term report due upon completion.
MIME 410,Materials Research Project,"Mining & Materials Engineering : A research project will be carried out, usually in groups, under the guidance of a staff member. A technical report will be prepared at the end and a formal presentation will be made on the research topic."
MIME 413,Strategic Mine Planning With Uncertainty,Mining & Materials Engineering : Strategic decision-making for mine planning given uncertain metal supply from orebodies and commodity demand. Stochastic optimization techniques in mine design and production scheduling. Uncertainty quantification and orebody representation. Stochastic mine optimization in applications from open pit and underground metal mines. Introduction to sustainable development and utilization of mineral resources.
MIME 419,Surface Mining,"Mining & Materials Engineering : Choice of a surface mining method. Analysis of soil and rock mass properties related to surface mining. Calculation and monitoring of stripping ratios, ultimate pit depth, slope stability, rock reinforcement, bench and berm dimensioning and ramp design. Loading and hauling systems. Surface layout and development. Water drainage systems. Production and cost analysis. Computerized design techniques."
MIME 421,Rock Mechanics,"Mining & Materials Engineering : Stresses around excavations: analytical and numerical solutions. Stability of underground and surface excavations: structural instability analysis with stereonet, instability due to high stress. Rock supports. Monitoring. Case studies."
MIME 422,Mine Ventilation,"Mining & Materials Engineering : Statutory regulations and engineering design criteria. Occupational health hazards of mine gases, dusts, etc. Ventilation system design. Natural and mechanical ventilation. Measuring and modelling air flow in ventilation networks. Calculation of head losses. Selection of mine ventilation fans. Air heating and cooling. Aspects of economics."
MIME 424,Underground Mining Methods,"Mining & Materials Engineering : Fundamentals of underground mining methods; orebody characteristics and host rock; drilling and blasting procedures; general and specialized equipment; mining method selection criteria; cost estimation; calculation of cut-off grade, ore recovery and dilution; mine developments and underground infrastructure: raises, chutes, loading pockets, dump points, raises, and ore bins; mine safety practice."
MIME 425,Applied Stochastic Orebody Modelling,"Mining & Materials Engineering : Representing uncertainty in orebody models and shortcomings of conventional methods including reserve reporting and mine planning. Stochastic spatial sequential simulation methods. Joint simulation of multiple correlated elements. Simulation material types. Introduction to geometallurgical modelling. Additional drilling, reserve classification, grade control and mine planning optimization. Risk quantification in life-of-mine production schedules."
MIME 426,Mine Design and Prefeasibility Study,"Mining & Materials Engineering : A case study design exercise. Design and selection of the facilities required to start production. Use of design criteria dictated by mining plans, geography, geology and government regulations. Professional appraisal of the technical and economic prefeasibility of developing a mineral deposit. Students prepare a professional-level report and seminar presentation."
MIME 442,"Analysis, Modelling and Optimization in Mineral Processing","Mining & Materials Engineering : Tools and methods of process analysis, modelling and optimization using flotation and comminution examples: sampling theory and statistics, data reconciliation, statistical experimental design. Kinetic models of flotation and comminution; simulation software. Residence time distributions: tanks-in-series and axial dispersion models. Combined flotation/comminution models. Introduction to geostatistics and data mining."
MIME 452,Process and Materials Design,"Mining & Materials Engineering : Design of new metallurgical plants, processes, materials and products based on 3 previous core courses; materials and heat balances, metal economics, design and optimization; materials selection, design and failure problems in various materials systems."
