Course Number,Course Name,Course Description
GMN-2902,Santé et sécurité pour ingénieur III,"Problèmes de santé et de sécurité du travail, lois et règlements. Accidents et maladies professionnelles. Éléments d'ergonomie et postures de travail. Conséquences des accidents, incidents et maladies professionnelles. Organisation de la sécurité en entreprise. Systèmes de prévention. Évaluation en sécurité. SIMDUT. Notions du risque. Types d'expositions. Fondements de normes. Évaluation des risques associés aux poussières, aux bruits, aux vibrations, à la contrainte thermique et à l'éclairage. Méthodes de mesure, contrôle et protection, normes et règlements. Sécurité industrielle. Mesure du niveau de danger. Acceptabilité du risque. Gestion du risque. Santé publique, sécurité et environnement. Devoirs et responsabilités juridiques des ingénieurs. Lois, normes et règlements en matière de sécurité, risques et gestion de risques. Maladies infectieuses et santé des travailleurs expatriés."
MED-1100,Santé et sécurité au travail : notions de base,"L'objectif de ce cours est d'initier l'étudiant aux notions de base des différentes disciplines liées à l'évaluation des problèmes de santé et de sécurité au travail et de le familiariser avec les moyens d'intervention susceptibles d'améliorer cette situation. Il s'intéresse à l'apport de disciplines telles que : l'hygiène industrielle, la toxicologie industrielle, l'épidémiologie, la sécurité au travail, l'ergonomie, la psychologie industrielle. Ce cours aborde aussi les structures ainsi que les mécanismes d'intervention en santé et sécurité au travail comme : la législation, la CNESST, le réseau public de la santé au travail, les syndicats et les employeurs."
GMC-4150,Introduction à l'aérodynamique,La statique de l'atmosphère. Équations intégrales de base en dynamique des fluides. Équations de Navier-Stokes. Écoulements incompressibles non visqueux : équations d'Euler et de Bernoulli; circulation et vorticité; théorème de Kelvin. Écoulements potentiels : équation de Laplace; solutions élémentaires; méthodes des panneaux source. Condition de Kutta; théorème de Kutta-Joukowski; génération de portance. Paramètres géométriques et aérodynamiques des ailes. Théorie des ailes minces symétriques et cambrées. Méthode de panneaux de vorticité. Aile d'envergure finie : vitesse et traînée induite; théorème de Helmholtz; loi de Biot-Savart; théorie de la ligne portante de Prandtl. Aérodynamique numérique et méthodes expérimentales.
GMC-4151,Propulsion aéronautique et spatiale,"Application des principes fondamentaux de la mécanique des fluides et de la thermodynamique à l'analyse des systèmes de propulsion. Les domaines à l'étude incluent les turboréacteurs, les turbopropulseurs, les turbosoufflantes et les statoréacteurs ainsi que leurs composantes internes tels les compresseurs, les foyers de combustion et les turbines. Enfin, une discussion sur l'évolution des fusées et les exigences pour une mission spatiale est présentée."
PHY-2100,Sciences de l'espace,Ce cours s'adresse aux étudiants inscrits à un programme de sciences et génie ou de géomatique. Il constitue une introduction à la recherche spatiale et aux problèmes spécifiques de l'espace. Sondes spatiales et satellites artificiels. L'environnement spatial et son utilisation. Luminescence atmosphérique terrestre et atmosphères planétaires. Les sources d'énergie cosmiques. Éléments d'astrodynamique. Exploration de l'espace. Programmes scientifiques et techniques. Politique spatiale canadienne.
ARC-2001,Architecture et environnement,"Ce cours présente les notions fondamentales des sciences de l'environnement qui peuvent être utilisées en design architectural. Les effets du climat sur le confort de l'usager ainsi que sur la forme, l'orientation, le plan et les matériaux du projet d'architecture sont étudiés. Des méthodes de design visant la prise en compte du vent, de l'ensoleillement et de la neige, de même que le recours aux énergies renouvelables (passives et actives) sont également discutées."
ARC-3103,Acoustique architecturale,"Ce cours vise la compréhension des principes acoustiques appliqués à l'architecture. Il porte principalement sur la nature et les propriétés physiques du son; sur l'évaluation physiologique de l'intensité sonore; sur la conception, le contrôle et l'évaluation de l'acoustique des bâtiments (salles de concert, logement, etc.); et sur le choix et l'assemblage des matériaux et dispositifs appropriés."
GBO-2040,Charpentes en bois I,"Notions préliminaires : formes structurales, propriétés physiques et mécaniques du bois, produits du bois utilisés en charpente, calculs aux états limites. Calculs de conception des éléments de charpente selon la norme CSA-086.1 : objectifs et exigences, effets et combinaisons de charges, éléments fléchis (en bois massif et en bois lamellé-collé), éléments comprimés, éléments tendus, éléments subis à des charges combinées, assemblages (clous, boulons, etc.)."
GBO-4070,Enveloppe du bâtiment,"Ce cours comprend les fondements de l'enveloppe du bâtiment (les principes de science du bâtiment appliqués à la conception de l'enveloppe du bâtiment), l'introduction aux composants et systèmes typiques de l'enveloppe du bâtiment en Amérique du Nord, les méthodes et procédures d'essai ou d'évaluation du rendement de l'enveloppe du bâtiment, et les codes et les normes de construction pertinents. L'accent est mis sur la conception détaillée des enveloppes de bâtiment, y compris les murs, les fenêtres, les toits et les niveaux inférieurs. Les problèmes critiques tels que les performances à long terme, l'efficacité énergétique, la durabilité et la conception intégrée seront abordés."
GCI-2004,Structures de béton,"Théorie linéaire. Théorie à la rupture : règlement ACNOR A23.3. Poutres, poteaux et dalles. Moment de flexion et force axiale. Effort tranchant. Calcul des flèches. Flambement. Semelles de fondations. Cadres rigides plans. Structures et édifices."
GCI-2007,Structures métalliques,"Introduction et bases de calcul des charpentes d'acier. L'acier et ses propriétés. Dimensionnement des pièces en traction, en compression pure et en flexion. Calcul des assemblages."
GCI-3001,Impacts environnementaux,"Ce cours permet de s'initier aux études d'impacts et d'acquérir les outils méthodologiques pour de telles études. Il comprend la revue des processus fédéral et provincial d'évaluation des impacts et de leur cadre réglementaire; la revue des méthodes disponibles, des études de cas types sur des projets récents; l'identification et la gestion des conflits en matière d'impacts environnementaux. Notions de vérification environnementale."
GCI-3002,Gestion des eaux,Gestion des eaux par bassin versant et gestion des eaux en milieu urbain. Notions de qualité des eaux. Notions en production d'eau potable et en traitement des eaux usées. Comportement du milieu récepteur face à un déversement. Notions en gestion des eaux pluviales. Conception préliminaire des systèmes impliqués. Réutilisation des eaux.
GEL-2003,Électrotechnique,"Ce cours donne à l'étudiant les notions fondamentales de l'électrotechnique qui sont essentielles aux ingénieurs en génie électrique. Les circuits monophasés et triphasés sont étudiés en régime permanent : calcul de tension et courant, calcul et mesure de puissance. Les transformateurs monophasés et triphasés sont étudiés en régime permanent. La conversion de l'énergie électrique à l'aide de l'électronique de puissance est introduite. Les montages convertisseurs de base sont étudiés."
GEL-4100,Commande industrielle,"Ce cours porte sur la commande automatique appliquée aux procédés industriels. Tout d'abord, les principaux algorithmes monovariables sont traités dans le domaine continu : régulateur PID, commande de rapport, commande cascade, anticipation, prédicteur de Smith et commande à modèle interne. L'analyse et la commande des procédés multivariables sont ensuite présentées. L'accent est mis sur la commande continue algébrique décentralisée ou avec découpleurs. La gestion des contraintes est également considérée. Finalement, la commande numérique est abordée : chaîne d'acquisition de données, systèmes discrets, synthèse directe et commande à modèle interne. Les travaux pratiques, effectués en laboratoire, permettent une familiarisation avec les systèmes de commande industriels."
GEL-4799,Dangers de l'électricité,"Cette formation est requise pour l'accès à quelques-uns de nos laboratoires (locaux), et donc pour certains cours. Elle est exigée pour des raisons de norme technique de sécurité."
GMC-3012,Introduction à la mécanique du bâtiment et aux énergies renouvelables,"Ce cours constitue une introduction à la mécanique du bâtiment en abordant les thèmes suivants : conditionnement de l’air, air humide, confort thermique, qualité de l’air intérieur, thermique du bâtiment, charge de chauffage, rayonnement solaire, charge de refroidissement, simulation énergétique, réseaux de distribution de fluide, éclairage. De plus, une partie du cours est consacrée aux énergies renouvelables, en particulier à la géothermie et à l’énergie solaire. Finalement, le cours propose à l'étudiant de réfléchir sur l’importance de l’énergie dans nos vies, dans un contexte de développement durable."
GMC-3015,Conception intégrée des systèmes CVAC-R,"Ce cours permet de mettre en application les principes du chauffage, de la ventilation, du conditionnement de l’air et de la réfrigération dans le cadre d’études de cas, d’analyse et de projets de conception. Il aborde des concepts et des stratégies liés à l’efficacité énergétique et au développement durable. L’étudiant apprend également à concevoir ou à choisir les principaux équipements utilisés en mécanique du bâtiment en utilisant des outils numériques de simulation de bâtiments. Le cours adopte une approche multidisciplinaire qui permet à l’étudiant d’interagir avec des intervenants d’autres domaines tels que l’architecture et le génie civil (conception intégrée)."
GML-4151,Introduction aux matériaux pour la santé,"Science et ingénierie des matériaux (métaux, polymères, céramiques, verres) pour des applications médicales. Ingénierie du système cardiovasculaire et du système squelettique; morphologie structurale et fonctionnelle; éléments d'anatomie et de physiologie; notions de biocompatibilité et d'hémocompatibilité. Biomatériaux employés pour fabriquer les dispositifs de suppléance fonctionnelle des systèmes cardiovasculaires et squelettiques. Problématiques cliniques et stratégies d'ingénierie pour les modifications de surface; aspects hémocompatibles, tribologiques et de compliance mécanique. Analyse des principaux produits commerciaux."
GIN-2010,Gestion opérationnelle des systèmes d'entreprise,"La gestion opérationnelle : les prévisions de la demande; la gestion des stocks, les modèles déterministes et stochastiques; le contrôle des inventaires. Analyse ABC. La gestion des articles dont la demande est dépendante. Notions de nomenclature et planification des besoins en matières (MRP). La planification : information requise. Méthodes classiques de planification. Introduction à l'ordonnancement. Outils informatiques pour la gestion de la production. Techniques d'ordonnancement et de contrôle de production. La fiabilité des systèmes. La fiabilité des structures série, parallèle et k-parmi-n. Les concepts de maintenabilité et de remplacement préventif. Les files d'attente : modèles de base à un et plusieurs canaux parallèles de service. Le facteur humain et l'ergonomie."
GIN-2110,Optimisation des systèmes et des réseaux,"Modèles de programmation linéaire. Méthodes de résolution graphique, algébrique, algorithme du simplexe. Théorie de la dualité. Analyse de sensibilité. Programmation en nombre entier. Méthode des coupes. Programmation non linéaire. Optimisation avec et sans contrainte. Conditions de Kuhn-Tucker. Outils informatiques. Programmation dynamique. Principes d'optimalité. Théorie des graphes et réseaux. Algorithmes de résolution. Exemples d'application."
GIN-3010,Conception et implantation des systèmes de production,"Ce cours traite de la conception d'un poste de travail, d'une cellule de travail et d'un centre de production ou de distribution. Il définit les principales caractéristiques propres à chacun de ces systèmes, ainsi que les éléments de mesure de leurs performances. Il traite du développement et de l'implantation de chacun de ces systèmes."
GIN-3110,Environnement et cycle de vie des produits,"Études d'impact. Outils méthodologiques pour de telles études. Comprend la revue des processus fédéral et provincial d'évaluation des impacts et de leur cadre réglementaire; la revue des méthodes disponibles, des études de cas types sur des projets récents; la détermination et la gestion des conflits en matière d'impacts environnementaux. Notions de vérification environnementale. Méthodes d'analyse et d'évaluation du cycle de vie des produits (conception, fabrication, assemblage, distribution, exploitation, maintenance, récupération, valorisation ou élimination propre). Norme ISO relative à l'environnement."
GIN-3220,"Analyse des risques, fiabilité et maintenance",Introduction à l'analyse et à l'évaluation des risques. Analyse des modes de défaillance. Arbre de défaillance et arbre de cause. La fiabilité des systèmes réparables et non réparables. Notion de la disponibilité et de la maintenabilité. Analyse de systèmes avec composants indépendants et dépendants. Processus de comptage. Processus markoviens. Stratégies de maintenance. Analyse de données et conception optimale des systèmes. Tests accélérés. Approche bayésienne.
GSO-2105,Achat et approvisionnement,"Ce cours est une introduction aux principes et aux connaissances fondamentales  de la gestion des achats et des approvisionnements. Le cours présente les différents aspects (techniques, administratifs et relationnels) des fonctions achat et approvisionnement et vise également à expliquer comment une gestion efficace de ces fonctions contribue à améliorer et à assurer la pérennité de la position concurrentielle de l'entreprise."
GSO-3103,Ingénierie de la chaîne logistique,"Ce cours montre comment la logistique intégrée peut être utilisée comme une arme concurrentielle offensive pour créer de la valeur. Il expose la démarche à suivre pour concevoir des réseaux logistiques intégrés efficaces à l'aide de modèles d'optimisation et d'outils informatiques. L'accent est mis sur le contexte international, la méthodologie d'intervention en entreprise et les outils d'aide à la décision. On aborde, notamment, des problèmes tels que la sélection des sites d'affaires et leurs missions, le choix des moyens de transport, la planification stratégique de la capacité des installations, et le design de réseaux logistiques éco-efficients."
GCH-1007,Procédés de mise en forme des matières plastiques,"Ce cours a pour objectif de donner une bonne compréhension des différents aspects de la mise en forme des matières plastiques par les procédés d'injection et d'extrusion. Moulage par injection : géométrie de la vis, séquences du procédé discontinu, cycle, architecture, remplissage et fermeture du moule, compréhension et utilisation des diagrammes PVT, critères de conception des pièces, transferts thermiques (pièce/moule), etc. Procédé d'extrusion : monovis et bivis. Les différentes géométries de vis. Étude des mécanismes de transport et de fusion de la matière plastique. Malaxage dispersif et distributif. Périphériques. Différents types de filières (filières de tubes, de gaines tubulaires, de feuilles, etc.). Calcul des débits d'extrusion."
GMC-4200,Fabrication assistée par ordinateur,"Automatisation de la fabrication. Machines-outils à commande numérique : technologie; langages machine et conversationnel; cellules et applications. Robotique : technologie des robots; langages, Karel, cellules robotisées, applications diverses. Les systèmes de fabrication automatisée : véhicules autoguidés et convoyeurs, AS/RS; conception de systèmes TG; pilotage, automates (API) et langages; simulation. Intégration : CAO-FAO, communication et réseaux locaux (MAP). Justification économique. Des laboratoires d'usinage sur-MOCN, de robotique pour l'assemblage, de systèmes de fabrication piloté par automate, ainsi que de CFAO sont prévus."
GMC-4201,Ingénierie de la qualité,"Le cours se divise en trois parties. Première partie : contrôle de la qualité de la conformité : métrologie; contrôle dimensionnel des longueurs et des angles, contrôle géométrique de rectitude, de planéité, de circularité, de parallélisme, de perpendicularité, de localisation et autres; inspection manuelle, automatisée et par calibres à limites. Deuxième partie : contrôle statistique : notions de base, échantillonnage, contrôle par lots et en cours de procédé, analyse de capacité; implantation et outils d'application des techniques statistiques. Troisième partie : assurance de la qualité : normes ISO-9000, documentation du système qualité; implantation et amélioration de la qualité. Plusieurs normes sont présentées. Quatre laboratoires complètent la formation pratique."
GMC-4202,Procédés et développement de produits,"Approfondissement de la fabrication mécanique. Outils pour le développement de produits et de procédés : principes de la conception pour la fabrication; techniques de prototypage et d'outillage rapides; fabrication d'outillage; modélisation, simulation et commande de procédés; amélioration de produits et de procédés. Développement, mise en production et fabrication de produits : application aux procédés (usinage, formage métallique des poudres, coulage des métaux, etc.). Projet, exercices pratiques, utilisation de logiciels et d'équipement de production."
GIF-4101,Introduction à l'apprentissage automatique,"Ce cours porte sur les méthodes permettant l'inférence à partir d'observations de modèles de classement, de régression, d'analyse de données ou de prise de décision. Ces méthodes se caractérisent par une phase d'entraînement à partir de données ou d'expériences, afin d'effectuer des tâches qui seraient difficiles ou impossibles à faire par des moyens algorithmiques plus classiques. Le cours aborde différentes approches actives en apprentissage et cherche à expliquer leurs mécanismes de base. Une perspective applicative de ces différentes techniques est également présentée, avec un accent particulier sur l'utilisation d'outils logiciels modernes."
GLO-2100,Algorithmes et structures de données pour ingénieurs,"Conception et analyse d'algorithmes : notions d'ordre; comportement du meilleur, du moyen et du pire cas. Conception et développement d'algorithmes : notion de types abstraits et modularité, programmation générique, structures de données classiques : les listes, les piles, les files (avec et sans priorité), les arborescences, les graphes, les tables de dispersion et les monceaux binaires, algorithmes de tri."
IFT-4102,Techniques avancées en intelligence artificielle,"Agents intelligents. Résolution de problème par exploration : approches classiques, informées et d'adversité. Problèmes de satisfaction de contraintes. Apprentissage automatique : supervisé (arbres de décision, ensembles, approches statistiques, réseaux de neurones, etc.), non supervisé et par renforcement. Raisonnement probabiliste et prise de décision (simple et complexe). Applications de l'intelligence artificielle."
GMC-4250,Mécanique des matériaux composites,Ce cours a pour objectif d'apporter à l'étudiant les moyens d'utiliser efficacement les matériaux composites stratifiés pour la conception de pièces et de structures. On y aborde principalement les méthodes de calcul pour analyser le comportement mécanique de composites stratifiés. Les étudiants sont amenés à développer un programme sur le logiciel Matlab ou Maple pour effectuer des calculs de plaques stratifiées. Une démonstration dans ABAQUS initie les étudiants à l'utilisation de logiciels d'éléments finis pour analyser le comportement d'une structure composite. Des laboratoires permettent aux étudiants d'apprendre quelques techniques simples de fabrication et d'appliquer les connaissances théoriques vues en cours en réalisant des essais mécaniques.
GML-2007,Comportement mécanique et essais des matériaux,"Principe fondamental : métallurgique et mécanique. Propriétés mécaniques (résistance, ductilité, résilience, ténacité, fatigue et fluage). Mécanismes de rupture. Mécanismes de durcissement. Caractéristique de rupture. Plan de contrôle de rupture. Comportement mécanique des composites et céramiques. Essais mécaniques : dureté, traction, résilience, fatigue."
GML-2250,Propriétés et choix des matériaux,"Dans ce cours, l'étudiant apprend à déterminer l'indice de performance des matériaux selon les exigences de la conception. Il choisit ensuite un matériau selon les indices de performance et les procédés de fabrication en utilisant des banques de données et les méthodes avancées de choix des matériaux. Une analyse des choix obtenus est effectuée selon les critères secondaires, soit la durée de vie, la sécurité, l'environnement et le coût. Les notions de base sur la tribologie et les modes de dégradation des matériaux sont abordées. Différents types de matériaux commercialement disponibles tels que les céramiques, les composites, les plastiques, les aciers (aciers inoxydables, aciers-outils, aciers au carbone), les alliages légers et les métaux non ferreux, ainsi que leurs propriétés et leur domaine d'utilisation sont présentés. Les méthodes d'amélioration des propriétés, telles que des traitements thermiques et des traitements de surface, sont introduites afin de donner à l'étudiant des outils supplémentaires dans son choix des matériaux."
GML-2251,Contrôle non destructif des matériaux,"La qualité et les facteurs de qualité. Description des défauts apparaissant lors de l'élaboration, de la transformation et du traitement thermique des matériaux. Techniques de mesure des principales variables jouant sur la qualité des produits métallurgiques : contrôle des éléments résiduels, de la température, de la pression, des débits et de l'humidité. Méthodes d'évaluation non destructives des matériaux : radiographie, ultrasons, courants de Foucault, ressuage, magnétoscopie, émission acoustique, etc. Contrôle des états de surface et mesure d'épaisseur. Applications et réalisations du contrôle de qualité sur des pièces coulées, forgées ou laminées et à des joints soudés ou collés."
GML-3000,Soudage des matériaux,"Dans ce cours, différentes techniques de soudage par fusion sont présentées et leurs caractéristiques sont abordées. L'étudiant apprend à produire ou à interpréter des dessins techniques liés au soudage. L'effet de la chaleur introduite dans le matériau sur les propriétés de la soudure et celles de la zone affectée thermiquement est analysé. Une attention particulière est accordée aux conséquences métallurgiques, mécaniques et chimiques du soudage telles que la fissuration du cordon, la sensibilisation ou l'affaiblissement de la zone affectée thermiquement. Les mesures correctives permettant de minimiser ces conséquences sont abordées. Les techniques appropriées pour le soudage de différentes classes de matériaux sont présentées ainsi que des exemples de défaillances dues au soudage. Finalement, les méthodes de contrôle de qualité de la soudure sont discutées."
GEL-1000,Circuits,"Éléments de base : sources, résistance, inductance, condensateur, transformateur idéal. Lois de Kirchhoff, théorèmes de Thévenin et de Norton, superposition. Formulation des équations d'équilibre : méthodes des mailles et des noeuds. Analyse transitoire. Circuits du premier et du deuxième ordre. Analyse des circuits par la transformation de Laplace. Introduction à SPICE."
GEL-1002,Systèmes et mesures,"Ce cours permet à l'étudiant de développer une habileté à la prise de mesures électriques. On y donne un aperçu général des instruments de mesure (voltmètre, ampèremètre, oscilloscope, pont d'impédance, etc.), de leur limitation et de leur influence sur les systèmes mesurés. Quelques types de capteurs et de montages requis pour la mesure de variables physiques sont présentés. À travers différentes techniques de mesure, on aborde les notions importantes pour la simplification et l'analyse de circuits comme l'identification de circuits équivalents (équivalents Thevénin, par exemple). Les méthodes d'études de circuits en régime sinusoïdal permanent sont développées ainsi que quelques notions sur les fonctions de transfert et la réponse en fréquence."
