Course Number,Course Name,Course Description
GEL-4250,Commande des systèmes avancée,"Représentation d'état : représentation continue et discrète, propriétés, observabilité et gouvernabilité. Observateurs : Luenberger, filtre de Kalman. Commande modale : continue et discrète, ajout d'une action intégrale, ajout d'un observateur. Commande linéaire quadratique (LQ) : continue et discrète, ajout d'une action intégrale, ajout d'un filtre de Kalman (commande LQ Gaussienne). Commande prédictive : principe de l'horizon fuyant, critère de commande, équations de prédiction, paramètres de réglage, contraintes. Commande robuste : performances fréquentielles, incertitudes, stabilité et performance robustes, design des régulateurs."
GIF-1003,Programmation avancée en C++,"Programmation orientée objet en C++. Éléments de syntaxe et sémantique. Implantation de classes : encapsulation, méthodes et attributs de classe. Surcharge des méthodes et des opérateurs. Notion de contrat et test unitaire. Normes de programmation. Héritage, hiérarchie de classes et polymorphisme. Gestion de la mémoire. Gestion des erreurs et des exceptions. Librairie standard du C++ (STL)."
GLO-4001,Introduction à la robotique mobile,"Ce cours offre un aperçu des principes généraux de la robotique mobile. Les composantes de bases utilisées en robotique mobile, telles que les actionneurs et les capteurs (sonar, laser, caméras et centrale inertielle), sont présentées. Une brève introduction aux boucles d'asservissement est aussi abordée. La partie algorithmique du cours traite de la locomotion, la localisation, la navigation, l'exploration et la cartographie de l'environnement."
GMC-3300,Mécatronique,"Apprentissage des concepts de la mécatronique à l'aide de projets. Rappels sur les éléments de base, les circuits logiques et analogiques, les capteurs, les transistors de puissance et les actuateurs. On insiste particulièrement sur la programmation d'un microcontrôleur, le langage C, le langage machine et l'interfaçage avec les systèmes mécaniques. Commande de puissance, amplification, pont, modulateur d'ondes et asservissement PID. L'étudiant est amené à réaliser des projets sur l'acquisition de données, le conditionnement de signal, la commande de moteurs à pas et CC asservis, une valve proportionnelle et son intégration dans un système de contrôle, etc."
GMC-3351,Éléments de robotique,"Introduction. Rappels de cinématique et de dynamique, mouvement des corps rigides dans l'espace. Modèles géométrique, cinématique et dynamique des manipulateurs. Planification de trajectoires et de tâches à réaliser. Principes de la commande d'un robot."
IFT-1700,Programmation de base en Visual Basic .Net,"Introduction aux notions d'algorithmique et aux langages de programmation : instructions, structures de décision et de répétition, sous-routines et fonctions. Interface Visual Basic .Net et son environnement, programmation orientée objet pilotée par les événements sous Windows, construction de programmes et de formulaires. Opérations normales d'un langage de programmation, graphisme et événements. Opérations avec les fichiers séquentiels et directs. Accès aux bases de données. Version professionnelle de Visual Basic .Net."
GAE-2005,Tracteurs et systèmes hydrauliques,"Thermodynamique et construction des moteurs à combustion interne. Turbocompression, lubrification, refroidissement et régulateur de vitesse. Transmission. Traction. Cinématique et dynamique du tracteur agricole : transfert de poids, stabilité et attelage des instruments. Systèmes hydrauliques : fluides, moteurs, pompes et valves hydrauliques. Analyse et design des circuits hydrauliques. Transmission hydrostatique."
GMC-4048,Analyse et synthèse cinématique des mécanismes,"Classification des mécanismes, mobilité et contraintes cinématiques, rappels de cinématique des corps rigides. Analyses graphique et algébrique de la cinématique des mécanismes plans. Analyse statique et équilibrage des mécanismes plans. Synthèse des mécanismes. Éléments de la théorie des vis."
GMC-4054,Simulations numériques des écoulements industriels,"Ce cours vise à développer la maîtrise des outils de simulations numériques des écoulements de fluide. Une classification des techniques de calcul en mécanique des fluides numérique aide à bien définir un problème d'écoulement en mode incompressible, compressible et multiphase en utilisant les concepts de conditions frontière, techniques de maillage et évaluations de sa qualité, de traitement de la turbulence et des surfaces libres et de la vérification de la validité d’une simulation. Une partie théorique couvre l'utilisation des méthodes de calcul à l'aide de codes commerciaux, complétée d'une partie pratique impliquant un projet de simulation de niveau plus avancé et un exposé oral supplémentaire."
GMC-4100,Commandes hydrauliques et pneumatiques,Identification des composantes d'un système hydraulique et pneumatique. Sélection des éléments requis par une fonction donnée. Élaboration de circuits simples et choix des composantes appropriées. Conception des systèmes hydrauliques et pneumatiques. Opération d'un système et détermination de la fonction des différents éléments. Asservissements hydrauliques et électrohydrauliques. Automatismes pneumatiques. Travaux pratiques.
GMC-4350,Turbomachines,"Théorie des turbomachines axiales et radiales (pompes, turbines, compresseurs, etc.), quantité de mouvement, triangles de vitesse. Principes de fonctionnement, similitude, courbes caractéristiques, emploi en parallèle et en série, diagrammes entropie-enthalpie. Pertes de charge et fuites, cavitation, rendements. Éléments de conception et d'évaluation des systèmes turbomachines, comportements hors régimes normaux."
GMC-4351,Modélisation et analyse en CAO,Modélisation géométrique en conception assistée par ordinateur (CAO) et en analyse par la méthode des éléments finis (MEF). Objets élémentaires et hiérarchies des modèles. Techniques de création et de modification des courbes/surfaces. Structure des données et modélisation solide de systèmes mécaniques complexes avec logiciels industriels. Modélisation par la MEF : formes variationnelles en mécanique des solides et des fluides et en transfert thermique. Discrétisation et approximation par éléments finis. Maillage automatique et définition des données physiques. Analyse des résultats et visualisation graphique des résultats. Travaux pratiques et exercices en analyse des contraintes et en transfert thermique. Réalisation d'un projet de synthèse avec des logiciels CAO/MEF industriels.
ENT-1000,Savoir entreprendre : la passion de créer et d'agir,"Ce cours d'introduction à l'entrepreneuriat s'adresse à tout étudiant inscrit au premier cycle. Il vise à développer le sens de l'initiative et l'esprit d'entreprise chez l'étudiant, afin de lui faire découvrir et exploiter son plein potentiel entrepreneurial. Les connaissances transmises à l'étudiant concernent à la fois l'entrepreneur et le processus créatif par lequel il mène son projet à terme, qu'il s'agisse d'un projet social, commercial, coopératif, artistique ou autre. Des exemples concrets sont présentés pour illustrer la passion qui anime les entrepreneurs, leur besoin de créer et d'innover et leur orientation vers l'action. Offert en classe ou à distance, ce cours joue un rôle clé dans le développement des compétences entrepreneuriales. Le cours inclut la réalisation d'une esquisse entrepreneuriale afin de sensibiliser l'étudiant aux réalités d'un projet entrepreneurial et développer une vision plus juste des défis à considérer. L'esquisse n'étant pas un plan d'affaires complet, le cheminement de ce cours demeure avant tout la découverte et le développement du potentiel entrepreneurial de l'étudiant et non la création d'une entreprise."
ENT-2023,Entrepreneuriat technologique,Ce cours vise à acquérir une compétence distinctive de gestion d'entreprises technologiques. Il permet à l'étudiant de se familiariser avec les particularités du processus de création et de développement de telles entreprises.
ENT-3000,Portfolio entrepreneurial I,"Préalables : être inscrit au profil entrepreneurial ou au microprogramme en développement des compétences entrepreneuriales et détenir une moyenne égale ou supérieure à 2,67 calculée sur 24 crédits et plus. Le portfolio entrepreneurial permet à l'étudiant de développer un projet lié à son domaine d'études, d'établir un réseau de contacts et d'améliorer ses compétences entrepreneuriales. Un soutien personnalisé est assuré par un conseiller d'Entrepreneuriat Laval tout au long du développement du projet. L'accompagnement facilite la démarche de l'étudiant et lui permet de valider et d'approfondir son idée de projet, d'orienter ses démarches et d'élaborer son plan d'action."
ENT-3010,Portfolio entrepreneurial II,"Le portfolio entrepreneurial permet à l'étudiant de développer un projet lié à son domaine d'études, d'établir un réseau de contacts et d'améliorer ses compétences entrepreneuriales. Un soutien personnalisé est assuré par un conseiller d'Entrepreneuriat Laval tout au long du développement du projet. L'accompagnement facilite la démarche de l'étudiant et lui permet de valider et d'approfondir son idée de projet, d'orienter ses démarches et d'élaborer son plan d'action."
GMC-3550,Projet d'ingénierie,"Ce projet permet à l'étudiant, soit d'appliquer et d'approfondir des connaissances acquises dans d'autres cours, soit de préparer un travail de plus grande envergure qui demande la synthèse des connaissances acquises antérieurement. Le sujet du projet peut être fourni par un professeur, qui en assume la direction, ou par l'étudiant qui doit alors trouver un professeur du Département qui accepte de superviser son projet. L'inscription à ce cours est sujette à l'approbation du Département. Si l'ampleur du projet le justifie, il peut être réalisé par une équipe d'au plus deux étudiants."
GMC-3551,Projet spécialisé,"Projet permettant de faire la synthèse ou d'appliquer des connaissances acquises dans un ou des cours du programme. Le travail est effectué sous la direction d'un professeur. Une proposition de projet doit être soumise pour approbation au responsable du cours, au plus tard pendant la première semaine du trimestre. Un rapport doit lui être remis à la fin du trimestre. Ce rapport est évalué suivant les modalités décrites dans le plan de cours."
ANL-2020,Intermediate English II,"Cours de niveau intermédiaire avancé destiné aux étudiants qui peuvent s'exprimer tant à l'oral qu'à l'écrit dans des situations courantes simples et qui peuvent lire et rédiger des textes relativement simples. Compréhension de l'oral et de l'écrit; expression orale et écrite. Structures grammaticales, vocabulaire et expressions idiomatiques, prononciation."
