Course Number,Course Name,Course Description
ME4703*,Mechanical Engineering Measurements,"Discusses a variety of measurement techniques used in Mechanical Engineering.  Topics include analog and digital measurement systems, frequency response, calibration and assessment of uncertainty. The focus is on the analysis and design of measuring instruments.  Laboratory exercises include measures of time and rate, displacements, stress and strain, force, pressure, flow, temperature, and vibrations."
ME5113,Advanced Solid Mechanics of Composites,"Introduction to stress analysis that deals with anisotropy of stress and general equations of the theory and elasticity. The elastic equilibrium and boundary value problem formulations are considered. Introduction to the modelling of inhomogeneous composite solids, the effective moduli theory and the elasticity of laminated and fiber enforced composite, as well as nanostructured composite theories are covered."
ME5122*,Solid State Phenomena,"Covers the fundamental aspects of crystallographic structure and their effects on the physical and mechanical properties of solids wiith emphasis on metallic materials with engineering applications. The importance of selecting alloying elements will be explored to optimize various properties such as but not limited to strength, ductility, fatigue, creep, corrosion, electrical, and magnetic. Construction and analysis of binary and ternary phase diagrams, which are critical in alloy design, complemented with computational thermodynamics will be covered. At the end of the course, the students are expected to understand the design and processing of commercial alloys."
ME5173*,Advanced Kinematics of Manipulators,Various methods for solving the forward and inverse displacement problems are described. Particular emphasis is made on the use of screw theory for the derivation of the Jacobian matrix. The selection of alternate frames of reference for describing the Jacobian are also discussed. Methods used in the solution of the inverse displacement problem and the inverse and forward velocity problems for kinematically redundant manipulators are discussed.
ME5183*,Industrial Robotics and Automation,"Brief introduction to robot kinematics including forward and inverse displacement and velocity solutions. An introduction to trajectory planning. Description of common uses of robotics in the manufacturing industry. Description and differences between soft and hard automation particularly in material handling systems. Fundamentals of sensors, actuators and controllers. Examples of automated machinery conveyor systems, feeder systems and packaging systems. Lab introduces different components of a flexible manufacturing systems. Graduate students enrolling in this course must submit an additional project in order to receive credit for this course."
ME5223*,Finite Element Analysis,"Introduction to the basic concepts of finite element analysis (FEA) including domain discretization, element types, system matrix assembly, and numerical solution techniques. Application of FEA to solve static, dynamic and harmonic problems of linearly elastic solid bodies and heat transfer will be covered in detail. Graduate students enrolling in this course must submit an additional project in order to receive credit for this course."
ME5243*,Machining Theory and Practice,"The fundamentals of metal cutting theory will be examined with particular emphasis on understanding cutting forces, stresses, strains, strain rates, and temperatures during the cutting process. Tribological issues, tool wear, and tool life will also be presented. Tools typically available to the manufacturing engineer such as Computer-Aided Design (CAD), Computer Aided Manufacturing (CAM), and Computer Numerical Control (CNC) Programming will compromise a significant portion of the course. Using the machine shop in the Mechanical Engineering Department, students will extend classroom concepts to practical scenarios and situations on the machine shop floor."
ME5253*,Codified Design and Failure Analysis,"This senior level course examines the application of mechanical design to engineering practice. In particular, the course will examine codified design of steel structures and the analysis of common failures that occur in service."
ME5283*,Micro/Nano Manufacturing,"Review of principles and practices of micro/nano fabrication technologies with research and industrial perspectives.  Introduction to micro/nano fabrication and its applications in MEMS/NEMS, renewable energy and biomaterials; materials selection; silicon processing; lithography process; thin film fabrication; advanced lithography process; characterization and micro/nano measurement techniques; atomic force microscopy and its applications."
ME5353*,Fracture Mechanics,"Principles of fractures mechanics and fracture analysis of engineering structures. Plane elasticity and mathematical methods to determine the elastic stress, strain and displacement fields. Fracture criteria and their limitations. Elastic-plastic fracture mechanics, J integral and COD. Fatigue fracture and S-N curve."
ME5493*,Internal Combustion Engines,The thermodynamics of internal combustion engines is introduced and applied to reciprocating spark ignition and compression ignition engines. The performance of each engine type is studied experimentally. The mechanical design of reciprocating engines is also examined.
ME5503*,Application of Computational Fluid Dynamics to Industrial Processes ,"General CFD topics such as grid topologies, discretization methods and errors, pressure-velocity coupling, solution methods for non-linear equations, and popular solution schemes such as the SIMPLE based methods. Introduction of extensions to core CFD techniques for a wide range of industrial applications, including turbulence models, multiphase flow models for problems in cavitation, boiling/condensation, and solidification/melting. Role of properties in CFD models, as related to non-Newtonian fluids, real and ideal properties for compressible flows, and combustion applications."
ME5534*,Experimental Methods in Fluid Dynamics,"This course will cover topics including the methodology, measurement uncertainty, and signal processing associated with fluid dynamics measurements. Various means of measuring pressure, velocity and visualizing flow will also be discussed."
ME5553*,Ocean Wave Energy Conversion,"Introduction to the fundamental concepts of ocean wave energy conversion. Topics include: ocean wave mechanics, the wave energy resource, basic wave energy conversion techniques, analytical and experimental modelling of wave energy converter, power take-off systems, and environmental impact assessment."
ME5578*,Low Speed Aerodynamics,"Fluid mechanics principles will be applied to describe external flow of incompressible gasses and liquids.  Emphasis will be placed on techniques used to predict aerodynamic forces and moments on aircraft.  Applications include aerofoils of infinite span, wing of finite span, aerodynamic design considerations, and high lift devices.  Other applications include the aerodynamics of wind-turbines and submarine hydrodynamics.  An introduction to computational aerodynamics will also be given."
ME5588*,High Speed Aerodynamics,"The principles of thermodynamics and fluid mechanics will be applied to describe external flow of compressible gases. Applications include two dimensional aerofoils, slender wings, aircraft and ballistics."
ME5643*,Automatic Controls II ,The first half of the course is an introduction to digital control. Emphasis is placed on understanding the relationships between analog and digital techniques. The second half concentrates on developing the basic mathematical framework for state space control. Several powerful abstract mathematical tools such as the projection theorem are introduced.
ME5653*,Predictive Control and Intelligent Sensors,"Study on the design and practical implementation of model predictive controllers and intelligent sensors for industrial type processes. Topics to be studied include sensor selection and instrumentation, signal processing and conditioning, process modelling and identification, computer interfacing, predictive control, optimization techniques, algorithm design and intelligent sensor modelling. The course is project oriented and includes the use of Matlab and LabWindows CVI software."
ME5673,Acoustics,"Review of single degree of freedom oscillators, vibration of strings and bars. Topics include: the acoustic wave equation, transmission phenomena, pipe cavities and waveguides, resonators, ducts and filters, environmental acoustics and an introduction to aeroacoustics (time permitting)."
ME5713*,Nondestructive Testing,"Principles of nondestructive evaluation, acoustic emission techniques, ultrasonics, microwave methods, electromagnetic probes, penetrating radiation."
ME5813*,Special Topics in Mechanical Engineering,Provides selected students an opportunity to either study concepts of a newly developed course or complete an independent project in association with an undergraduate course within the department. Permission of the instructor of the associated course is required.
ME5833*,Special Topics in Mechanical Engineering,Provides selected students an opportunity to either study concepts of a newly developed course or complete an independent or group-based course of study within the department. Permission of the instructor of an associated course is required.
ME5913*,Biomechanics I,"A number of topics in biomechanics are examined. Of particular interest is the mechanics of joints, and relation of the internal mechanics of joints to externally applied loads. Analysis techniques are introduced to facilitate analysis of the problems addressed in the course."
ME5933*,Industrial Ecology and Sustainable Engineering ,The goal is to develop awareness and knowledge on forward-looking thinking of interaction of technology with human induced transformation of materials and energy from the perspectives of environment and sustainability. Topics include: humanity and technology; concept of sustainability; key questions of industrial ecology and sustainable engineering; status of resources; technology and risk assessment; introduction to life cycle assessment (LCA); LCA impact assessment and interpretation; streamlining the LCA process.
ME5953*,Embedded Flight Control Systems,"Describes the aerodynamic forces, moments and propulsive thrusts which act on fixed wing model aircraft. Stability, control, and flight performance characteristics are also investigated. Development of a system model and theoretical control algorithm tailored for the characteristics of a specific model airplane. Each student will use this knowledge to develop an embedded firmware-based control system to provide some autopilot features to a model airplane."
