Course Number,Course Name,Course Description
Manufacturing Engineering 514,Integrated Manufacturing Systems,Fundamentals of integrated and competitive manufacturing. Manufacturing and operations strategy. Topics in production and operations management including: production planning and control systems; inventory management systems; process analysis and improvement; quality management systems.
Engineering 515,Project Management for Engineers,"Covers the application of project management principles such as planning, scope development, design, procurement, construction, commissioning and start-up to engineering projects. Class reviews aspects of a current major engineering projects and case studies."
Manufacturing Engineering 501,Modelling and Simulation of Manufacturing Systems,General modelling of production systems. Spreadsheet modelling for capacity analysis. Fundamentals of discrete-event simulation including: key concepts; simulation world views; the simulation study life cycle. Modelling and programming aspects of discrete-event simulation including: verification and validation; simulation animation; interfacing simulation software with other systems. Statistical aspects of discrete-event simulation including: random number and random variate generation; input process modelling; output analysis; variance reduction techniques. Applications of discrete-event simulation to the design and analysis of manufacturing systems.
Manufacturing Engineering 503,Computer-Aided Design and Manufacturing,"Hardware and software for computer-aided design and manufacturing (CAD/CAM) systems. Geometric modelling, transformation and visualization. Modelling of freeform curves and surfaces. Programming for computer numerically controlled (CNC) machining. Integration of CAD/CAM systems, Applications in motion analysis, structure analysis, optimization, rapid prototyping, reverse engineering and virtual engineering."
Manufacturing Engineering 509,Advanced Manufacturing Systems,Manufacturing strategy and competitive manufacturing. Queuing theory and its application to manufacturing systems analysis (including rapid modelling tools). Linear programming and its application to manufacturing systems problems. Scheduling problems in manufacturing. Supply chain modelling and integration. Enterprise resource planning systems.
Manufacturing Engineering 517,Experimental Design and Analysis,"Introduction to statistical Design of Experiments (DOE) techniques for efficient data collection, analysis and interpretation. Analysis of Variance (ANOVA), including blocking and nesting, in full and fractional factorial designs to understand sources of variation in performance. Robust design, including classical response surface and Taguchi techniques, to minimize effects of environmental factors on performance variability. Applications to product and process improvement."
Manufacturing Engineering 527,Project Engineering,"The project lifecycle. Project planning, scheduling, and control. Resource considerations. Cost estimating, planning, and performance. Project risk. Project personnel and organizational structures."
Manufacturing Engineering 533,Computer-Based Control for Industrial Automation,"Concepts of digital control. Digital circuits. Logic Controller architecture, programming using digital logic concepts, and interfacing. I/O devices sensors and actuators. Applications to work cells and production lines."
Mechanical Engineering 505,Robotics,"Kinematics, statics, dynamics and control of robot arms. Robot actuators, drives, sensors, and vision. Applications of robots."
